Artist,Album,Title,Key,BPM,Energy
Rock Instrumentals,Rock Instrumentals,Emo Rock x Pop Punk Place,Em,155.00,7
Rock Instrumentals,Rock Instrumentals,Pop Punk x Emo Rock x Avril Lavigne x MGK Away (Prod IVY),Em,80.00,6
Rock Instrumentals,Rock Instrumentals,ASAP Rocky x Lil Wayne ft Cordae LEVEL UP Trap Instrumental ,C#m,90.06,6
Rock Instrumentals,Rock Instrumentals,Rock x Pop Punk MGK Guitar No Drums Hold My Hand (ProreamUnion x IOF),C#,130.00,3
Rock Instrumentals,Rock Instrumentals,Iann Dior x Pop Punk Girl ,B,98.00,3
Rock Instrumentals,Rock Instrumentals,DARK Tyler The Creator x ASAP Twelvyy ft ASAP Rocky Horror HORROR SHOW ,C#m,130.01,5
Rock Instrumentals,Rock Instrumentals,Pop Punk x Punk Rock MGK x Jxdn x Sueco Night Pop Punk Instrumental,A,150.00,7
Rock Instrumentals,Rock Instrumentals,MGK Pop Punk Rock x Avril Lavignmo Feel Me (Prod @GAXILLICS x IOF),G,175.00,5
Rock Instrumentals,Rock Instrumentals,Metalcore Crabcore Instrumental PROPHECY Asking Alexandria ,Fm,131.01,7
Rock Instrumentals,Rock Instrumentals,Bad Omens x Architects x BMTH x Modern Metal Watch Me Burn,Fm,119.99,6
Rock Instrumentals,Rock Instrumentals,Pop Punk x Punk Rock MGK x Iann Dior Hot Wheels (Prod IOF),E,88.00,6
Rock Instrumentals,Rock Instrumentals,Metalcore x We Came As Romans Instrumental I Prevail Post Hardcore ,Em,150.00,8
Rock Instrumentals,Rock Instrumentals,BMTH x Bad Omens x Metalcore Vacant Metalcore Instrumental,Am,90.00,6
Rock Instrumentals,Rock Instrumentals,Metalcore x Melodic Rock DARK SKIES Bring Me The Horizon x Linkin Park ,C#m,85.00,5
Rock Instrumentals,Rock Instrumentals,Attic Lil Peep Guitar (Prod Splashgvng and King Theta),Gm,139.99,4
Rock Instrumentals,Rock Instrumentals,Pop Punk x Pop Rock Hyperpunk MGK x Sueco x Jxdn Escape,B,150.99,7
Rock Instrumentals,Rock Instrumentals,AFI x The Used Leaving Emo Rock Punk Rock Instrumental,Am,121.00,7
Rock Instrumentals,Rock Instrumentals,Foul Play 100 Gecs x Pop Punk ,B,85.00,6
Rock Instrumentals,Rock Instrumentals,MGK x Nirvana Pop Punk Emo Rock Blink 182 Tomorrow (Prod @GAXILLIC x IOF),G,125.00,7
Rock Instrumentals,Rock Instrumentals,Pop Punk x Emo Rock MGK x Iann Dior Dont Cry (Prod GAXILLIC x IOF),G#,80.00,5
Rock Instrumentals,Rock Instrumentals,Post Melodic Hardcore x Metalcore x Metal Echoes Metalcore Instrumental,F#m,149.00,6
Rock Instrumentals,Rock Instrumentals,pop punk emo scenecore almost had u,B,128.99,7
Rock Instrumentals,Rock Instrumentals,Pop Punk x Punk Rock MGK x Iann Dior Daydream (Prod IOF),B,133.00,6
Rock Instrumentals,Rock Instrumentals,Modern Metal x BMTH x Architects Inconstancy (prod IVY),Fm,80.00,7
Rock Instrumentals,Rock Instrumentals,Tied In Knots Iann Diorr x Travis Barker ,F#m,139.99,6
Rock Instrumentals,Rock Instrumentals,Pop Rock x Hyperpunk Squirreled,C,111.89,6
Rock Instrumentals,Rock Instrumentals,Midwest Emo Pop Punk Instrumental Going 2 College Hot Mulligan x Turnover,C,153.99,6
Rock Instrumentals,Rock Instrumentals,remghost natures guccihighwaters x LiL Lotus x tothegood ,F#m,120.00,4
Rock Instrumentals,Rock Instrumentals,AFI x The Used Hollow post hardcormo instrumental,A#m,88.50,7
Rock Instrumentals,Rock Instrumentals,Pop Punk x Punk Rock MGK x Iann Dior Far Away (Prod IOF),E,126.00,6
Rock Instrumentals,Rock Instrumentals,Sueco x Jxdn Pop Punk x Alternative Rock Make Up,G,95.00,8
Rock Instrumentals,Rock Instrumentals,Pop Punk x Punk Rock MGK x Iann Dior x BMTH Falling (Prod IOF),A,144.00,5
Rock Instrumentals,Rock Instrumentals,Bad Omens x MIW x Industrial Metalcore snakes,Bm,87.50,7
Rock Instrumentals,Rock Instrumentals,Pop Punk x Punk Rock MGK x Iann Dior Forget You (Prod IOF),Am,82.00,5
Rock Instrumentals,Rock Instrumentals,6obby x POORSTACY x Juice WRLAGGER Guitar s Rap Trap s ,Bm,141.00,5
Rock Instrumentals,Rock Instrumentals,hyperpop pop punk cannibal scenecore,Am,147.19,6
Rock Instrumentals,Rock Instrumentals,Renforshort x Indie Rock x Hyperpop Never,Em,152.25,6
Rock Instrumentals,Rock Instrumentals,BleghTRAP METAL ,D#m,122.41,4
Rock Instrumentals,Rock Instrumentals,Gunna x Lil Baby ft Iann Dior BLINDED Trap Instrumental ,Em,100.11,3
Rock Instrumentals,Rock Instrumentals,Sad Acoustic Guitar Trippie Redd XXXTENTACION Pop No Drums Bad Luck (Prod IOF),Bm,113.67,2
Rock Instrumentals,Rock Instrumentals,Pop Punk x Emo Rock x Easycore Belmont x MGK Rock Detention (Prod SRY x IOF),D,112.00,7
Rock Instrumentals,Rock Instrumentals,lofigrungesurf rock costa misery slow instrumental,F#,117.00,6
Rock Instrumentals,Rock Instrumentals,Pop Punk Hyperpop Pull Up,D#,85.08,7
Rock Instrumentals,Rock Instrumentals,A Day To Remember x Machine Gun Kelly Pop Punk BLOODSUCKER MGK ,A,147.00,6
Rock Instrumentals,Rock Instrumentals,Pop Punk x Pop Rock Dirt,F,110.01,6
Rock Instrumentals,Rock Instrumentals,I See Stars x A Skylit Drive Internet Famous Post Hardcore Instrumental,G#m,151.00,6
Rock Instrumentals,Rock Instrumentals,chill midwest emo instrumental jazz,C#,86.00,6
Rock Instrumentals,Rock Instrumentals,80s Indie Rock x Pop Punk Berry,C,80.00,7
Rock Instrumentals,Rock Instrumentals,Hyperpunk MGK x Glaive Hyperpop Guitar Fragments,A#,99.92,6
Rock Instrumentals,Rock Instrumentals,Alternative Rock Poorstacy x Travis Barker Alone,Em,79.99,8
Rock Instrumentals,Rock Instrumentals,Pop Punk x Punk Rock MGK x Iann Dior Sorry (Prod IOF),D#m,142.00,6
Rock Instrumentals,Rock Instrumentals,Asking Alexandria x Attack Attack The Massacre Post Hardcore,Bm,88.50,7
Rock Instrumentals,Rock Instrumentals,Sugar Coated 100 Gecs x Pop Punk ,C,107.74,7
Rock Instrumentals,Rock Instrumentals,Machine Gun Kelly Pop Punk WORTHLESS MGK Pop Punk Rock ,C#,80.00,6
Rock Instrumentals,Rock Instrumentals,Sueco Pop Punk x MGK x Avril Lavigne Rock Its Goinood! (Prod IOF),D#,95.03,6
Rock Instrumentals,Rock Instrumentals,Roddy Ricch x Gunna ft Future COVER UP Trap Instrumental ,Dm,124.95,4
Rock Instrumentals,Rock Instrumentals,Aries Anti Pop x Pop Punk Wasting Time,D#,154.92,6
Rock Instrumentals,Rock Instrumentals,BMTH x Paramore x MGK x Metal Last Summer,Fm,140.00,6
Rock Instrumentals,Rock Instrumentals,Machine Gun Kelly Pop Punk Rock TOXIC MGK Rock Acoustic Instrumental ,D,83.50,6
Rock Instrumentals,Rock Instrumentals,turnstile alternative rock punk rock blue moon ,G,84.00,6
Rock Instrumentals,Rock Instrumentals,Alternative Rock x Pop Punk Rocket,C,85.00,7
Rock Instrumentals,Rock Instrumentals,Pop Punk MGK x Jxdn x Travis Barker Punk Rock Kisses,A,80.01,6
Rock Instrumentals,Rock Instrumentals,Metalcore X Modern rock X Synth Rock CyberCrime,Cm,82.50,6
Rock Instrumentals,Rock Instrumentals,Pop Punk Rock Skeletons,E,156.01,7
Rock Instrumentals,Rock Instrumentals,Pop Punk x Emo Rock MGK x Avril Lavigne Closeoor (Prod @GAXILLICSx IOF),B,90.07,6
Rock Instrumentals,Rock Instrumentals,Pop Punk x Punk Rock MGK x Iann Dior Distance (Prod IOF),D#,82.00,7
Rock Instrumentals,Rock Instrumentals,Hyperpunk x Pop Punk Yeah,F#m,100.00,8
Rock Instrumentals,Rock Instrumentals,Glaive x Brakence Hyperpop Guitar Release,F,81.00,6
Rock Instrumentals,Rock Instrumentals,Midwest Emo x Mom Jeans Type Instrumental CIRCLE PIT! Pop Punk,A,137.96,7
Rock Instrumentals,Rock Instrumentals,Metalcore Ice Nine Kills Horror Metalcore MIDSOMMAR Heavy Metalcore ,G#m,80.00,7
Rock Instrumentals,Rock Instrumentals,guccihighwatersnothing nowherelund ,Am,140.00,4
Rock Instrumentals,Rock Instrumentals,"Nothing, Nowhere x Fatse x Guardin dreaming of u Midwest Emo",G,90.00,4
Rock Instrumentals,Rock Instrumentals,The Kid LAROI x Iann Dior Pop Guitar Thousand Miles,D,104.97,5
Rock Instrumentals,Rock Instrumentals,Emo Rock x Pop Punk Amnesia,A,100.00,7
Rock Instrumentals,Rock Instrumentals,Pop Smoke BOMBS AWAY ,Bm,143.00,3
Rock Instrumentals,Rock Instrumentals,Aries x Pop Punk Hyperpop Too High,D,92.50,4
Rock Instrumentals,Rock Instrumentals,MGK x Jxdn x Sueco Pop Punk Pacific,E,83.51,5
Rock Instrumentals,Rock Instrumentals,Sad Acoustic Guitar Trippie Redd XXXTENTACION Pop No Drums Wrong Time (Prod IOF),B,122.79,3
Rock Instrumentals,Rock Instrumentals,midwest emo pop punk instrumental throw,C#,81.00,6
Rock Instrumentals,Rock Instrumentals,Neck Deep x State Champs Pop Punk Safety Net (Prod IOF x King Theta) @prodbyIOF,D,94.00,7
Rock Instrumentals,Rock Instrumentals,Metalcore x BMTH x Linkin Park Alternative Rock Enemy,Dm,87.50,7
Rock Instrumentals,Rock Instrumentals,Sueco Pop Punk x MGK x Avril Lavigne Rock Loser (Prod Gaxillic x IOF),C#,96.05,7
Rock Instrumentals,Rock Instrumentals,Metalcore Hard Rock Asking Alexandria LIMBO Metalcore Instrumental ,Cm,100.00,8
Rock Instrumentals,Rock Instrumentals,Emo Rock x Pop Punk Romance,G,82.50,8
Rock Instrumentals,Rock Instrumentals,Pop Punk MGK x Sueco Punk Rock Good,D,83.00,7
Rock Instrumentals,Rock Instrumentals,tom delonge box car racer pop punk i miss you ,A,149.00,6
Rock Instrumentals,Rock Instrumentals,Pop Punk x Punk Rock MGK x Iann Dior x Sueco Last Resort (Prod IOF),A#,90.00,6
Rock Instrumentals,Rock Instrumentals,Midwest Emo x Anti Pop Ericdoa Honest,C#,149.94,5
Rock Instrumentals,Rock Instrumentals,Metal x Architects x Post Hardcore Instrumental Isolate (Prod IOF) @prodbyiof,Am,87.50,6
Rock Instrumentals,Rock Instrumentals,Indie Rock x Hyperpop x Aries Sunday,F#m,96.49,6
Rock Instrumentals,Rock Instrumentals,midwest emo pop punk instrumental high school reunion,A,86.50,6
Rock Instrumentals,Rock Instrumentals,Too Real Pop Punk x Iann Dior ,Dm,153.00,7
Rock Instrumentals,Rock Instrumentals,Cordae x Meek Mill SKYWALKER Trap Instrumental ,C#m,140.04,5
Rock Instrumentals,Rock Instrumentals,Two Feet x Dark Pop Lights on (prod IVY),Am,120.00,5
Rock Instrumentals,Rock Instrumentals,Sad Acoustic Guitar Trippie Redd XXXTENTACION Pop Find A Way (Prod IOF),G,79.99,3
Rock Instrumentals,Rock Instrumentals,Indie x Bedroom Pop Typ,Em,97.00,4
Rock Instrumentals,Rock Instrumentals,Sad Acoustic Guitar Trippie Redd XXXTENTACION No Drums Save Me (Prod IOF),Em,125.54,2
Rock Instrumentals,Rock Instrumentals,MGK x Jxdn x Travis Barker Pop Punk Aliens,D,90.00,7
Rock Instrumentals,Rock Instrumentals,Pop Punk x Punk Rock MGK x Iann Dior Ghosted (Prod IOF),F,150.00,5
Rock Instrumentals,Rock Instrumentals,Birdhouse Pop Punk x Dorian Electra x 100 Gecs ,B,90.14,6
Rock Instrumentals,Rock Instrumentals,HARD Aggressive 808 Creepy Horror THE THING Dark Trap Instrumental ,F#m,130.00,4
Rock Instrumentals,Rock Instrumentals,Post Malone Sad Acousti,A,150.01,4
Rock Instrumentals,Rock Instrumentals,dves x aftertheparty (prod remghost) ,A#m,120.00,2
Rock Instrumentals,Rock Instrumentals,Green Day x Emo Rock x Pop Punk Blvd Of Broken Dreams Instrumental (Prod IOF),G,83.50,5
Rock Instrumentals,Rock Instrumentals,tom delonge x the front bottoms dropping out emo pop punk,Bm,84.99,6
Rock Instrumentals,Rock Instrumentals,J Cole x Travis Scott HIGHWAY Rap s Chill Guitar Trap ,Bm,128.00,6
Rock Instrumentals,Rock Instrumentals,MGK Pop Punk Valentine (Prod IOF),Bm,82.50,5
Rock Instrumentals,Rock Instrumentals,Indie Rock x Bedroom Pop August,G,149.99,6
Rock Instrumentals,Rock Instrumentals,Jack Harlow x Migos DARKSIDE Cluanger Trap Instrumental ,C#m,112.81,5
Rock Instrumentals,Rock Instrumentals,Pop Punk Rock MGK x Iann Dior Guitar Here For You (ProreamUnion x IOF),E,91.00,4
Rock Instrumentals,Rock Instrumentals,Pop Rock Iann Dior x MGK x Jxdn Pop Punk Stuck,G#,110.99,6
Rock Instrumentals,Rock Instrumentals,80s Synth Pop x The Weeknd Goodbye,C,82.00,7
Rock Instrumentals,Rock Instrumentals,Pop Punk MGK x BMTH Rock Metal Mess (Prod alexanderbierk x IOF),Am,89.50,6
Rock Instrumentals,Rock Instrumentals,Indie Rock x Aldn x Glaive Plastic,Bm,109.98,8
Rock Instrumentals,Rock Instrumentals,Linkin Park x BMTH x Paramore Nu Metal Rap 2000s Break (Prod Kala x IOF),G#m,82.01,7
Rock Instrumentals,Rock Instrumentals,Sad Acoustic Guitar Trippie Redd x Country Pop No Drums Lonone (Prod IOF),F#,138.97,3
Rock Instrumentals,Rock Instrumentals,Sueco x Jxdn Pop Punk x Alternative Rock ze,Am,157.06,7
Rock Instrumentals,Rock Instrumentals,Indie Rock x Post Punk Surf Curse x girl in red Freaks,F#m,87.50,5
Rock Instrumentals,Rock Instrumentals,Pop Punk Rock Lipstick,E,92.51,8
Rock Instrumentals,Rock Instrumentals,Senses Fail x A Day To Remember Homesick Post Hardcore Instrumental,C,86.52,7
Rock Instrumentals,Rock Instrumentals,Avril Lavigne x MGK x Jxdn Pop Punk Crazy,C,154.92,7
Rock Instrumentals,Rock Instrumentals,Alternative Rock x Pop Punk Never,D#m,150.00,7
Rock Instrumentals,Rock Instrumentals,midwest emo surf rock pop punk instrumental best coast,B,93.00,6
Rock Instrumentals,Rock Instrumentals,alternative rock x midwest emo instrumental i walk alone  soft grunge,A,83.50,6
Rock Instrumentals,Rock Instrumentals,MGK x Travis Barker x Jxdn Punk Rock Hangover Pop Punk Instrumental,C,80.00,7
Rock Instrumentals,Rock Instrumentals,Lil Uzi x Rich the Kid SAUCE Trap Instrumental ,A#m,125.00,6
Rock Instrumentals,Rock Instrumentals,Aries x iann dior Lightning Speed,Cm,153.00,6
Rock Instrumentals,Rock Instrumentals,Hyperpop x Guitar Trash glaive,A#,133.93,6
Rock Instrumentals,Rock Instrumentals,Travis Scott x Migos ft Drake ACID Trap Instrumental ,Em,150.01,5
Rock Instrumentals,Rock Instrumentals,Metalcore x BMTH x Linkin Park Alternative Rock December,Em,140.01,7
Rock Instrumentals,Rock Instrumentals,Sad Acoustic Guitar RNB,G#m,123.46,3
Rock Instrumentals,Rock Instrumentals,Sad Acoustic Guitar Pop Punk No Drums High,G,90.00,3
Rock Instrumentals,Rock Instrumentals,Alternative Rock x Emo Rock No Way Back (Prod IOF x mampitsu),F#m,87.50,4
Rock Instrumentals,Rock Instrumentals,Aries x Indie Rock x Aldn Inside,F#m,87.00,6
Rock Instrumentals,Rock Instrumentals,MGK Pop Punk x Avril Lavigne x Willow Rock Emo Girl (Prod Gaxillic x IOF),D#,82.50,6
Rock Instrumentals,Rock Instrumentals,Post Malone x Clairo In,D#,120.00,4
Rock Instrumentals,Rock Instrumentals,Metalcore x Architects x Post Hardcore Wway,Cm,80.00,7
Rock Instrumentals,Rock Instrumentals,emo pop punk scenecore ramona flowers,C#,83.00,7
Rock Instrumentals,Rock Instrumentals,Pop Punk Rock Run,C,87.50,7
Rock Instrumentals,Rock Instrumentals,Emerald,D,150.00,6
Rock Instrumentals,Rock Instrumentals,Indie Rock x Bedroom Po,Am,117.00,4
Rock Instrumentals,Rock Instrumentals,Avril Lavigne x MGK Pop Punk x Punk Rock x Paramore Guitar Break Up (Prod IOF),C#,84.99,7
Rock Instrumentals,Rock Instrumentals,MGK Pop Punk Emo Rock x Sueco x Avril Lavigne Killing Me (Prod IOF),D#m,109.98,6
Rock Instrumentals,Rock Instrumentals,Sad Acoustic Guitar Trippie Redd XXXTENTACION Pop No Drums Safe Place (Prod IOF),C,137.28,2
Rock Instrumentals,Rock Instrumentals,Rock x Pop Punk MGK x Iann Dior Guitar Lost In Thoughts (Prod GAXILLIC x IOF),G,105.00,2
Rock Instrumentals,Rock Instrumentals,Easycore x Pop Punk x Metalcore FULL MOON Chunk No Captain Chunk ADTR ,C#,117.00,7
Rock Instrumentals,Rock Instrumentals,Roddy Ricch x Fabolous Ft Lil Skies BLISS ,Am,142.81,3
Rock Instrumentals,Rock Instrumentals,Nodding Off 93feetofsmoke ,A#m,79.32,5
Rock Instrumentals,Rock Instrumentals,Nirvana x Grunge x Alternative Rock Darkness,D#m,90.00,7
Rock Instrumentals,Rock Instrumentals,Pop Punk Rock Soda,E,145.00,7
Rock Instrumentals,Rock Instrumentals,Alternative Rock x Metalcore x Metal Temptation Metalcore Instrumental,F#m,115.00,6
Rock Instrumentals,Rock Instrumentals,Pop Punk Rock Walk,C#,85.00,6
Rock Instrumentals,Rock Instrumentals,Nu metal X Emo rock X Metalcore love in a heaven,A#m,88.50,7
Rock Instrumentals,Rock Instrumentals,Sad Acoustic Guitar Trippie Redd XXXTENTACION Pop No Drums Regret (Prod IOF),F#,92.00,3
Rock Instrumentals,Rock Instrumentals,HARark style HELLFIRE style Hip Hop Trap Instrumental ,Bm,100.00,4
Rock Instrumentals,Rock Instrumentals,Metal Drill Trap Metal Zillakami x City Morgue x Scarlxrd Hellraiser (Prod IOF),Cm,140.14,5
Rock Instrumentals,Rock Instrumentals,the story so far x neck deep x real friends hoodie pop punk instrumental,G,100.50,7
Rock Instrumentals,Rock Instrumentals,Travis Scott TEMPLE Hip Hop s Trap s Trap Instrumental ,Cm,130.01,5
Rock Instrumentals,Rock Instrumentals,Pop Punk x Punk Rock MGK x Iann Dior Moody (Prod IOF x King Theta),Gm,140.00,7
Rock Instrumentals,Rock Instrumentals,midwest emo pop punk instrumental maybe in another life,B,84.00,5
Rock Instrumentals,Rock Instrumentals,Pop Punk Rap STORIES MGK x Iann Dior Pop Punk ,G#,89.00,5
Rock Instrumentals,Rock Instrumentals,Metalcore Ice Nine Kills KINGDOM Melodic Dark Metalcore x Deathcore ,A#m,149.00,8
Rock Instrumentals,Rock Instrumentals,BMTH x MIW x Bad Omens x Metalcore ground,A#m,80.00,6
Rock Instrumentals,Rock Instrumentals,Brakence x Hyperpop Drill Emo Guitar 5g (Prod IOF),C,147.93,6
Rock Instrumentals,Rock Instrumentals,Pop Punk MGK x Sueco x Blink 182 OCTOBER Sad Pop Punk ,Gm,120.00,7
Rock Instrumentals,Rock Instrumentals,shinigami x 9tails (prod remghost),Cm,120.00,4
Rock Instrumentals,Rock Instrumentals,midwest emo grunge pop punk instrumental dont let me go,A,109.09,7
Rock Instrumentals,Rock Instrumentals,Juice WRLD x Halsey SECRETS Trap Instrumental ,Am,90.00,6
Rock Instrumentals,Rock Instrumentals,Modern Metal x BMTH x Architects CAGE (prod IVY),Dm,139.95,7
Rock Instrumentals,Rock Instrumentals,Sad Guitar Acoustic Emo Rock No Drums VHS,D,154.99,5
Rock Instrumentals,Rock Instrumentals,Pop Punk x Pop Rock MGK x Trippie Redd x Travis Barker Emotions,C,139.84,7
Rock Instrumentals,Rock Instrumentals,Sad Acoustic Emo Pop Pu,A#,92.00,4
Rock Instrumentals,Rock Instrumentals,"9tails, guardin, greaf cardiac (prod remghost)",Fm,120.00,6
Rock Instrumentals,Rock Instrumentals,Country Acoustic Guitar x Morgan Wallen Good Old Times (ProreamUnion x IOF),A#,128.00,4
Rock Instrumentals,Rock Instrumentals,MGK x Juice WRLD Pop Punk x Pop Rock Broken Smile (Prod IOF x King Theta),F,137.00,8
Rock Instrumentals,Rock Instrumentals,Indie Rock x Alternative Wine,G,119.99,5
Rock Instrumentals,Rock Instrumentals,Pop Punk Rock Honestly,C#,150.00,8
Rock Instrumentals,Rock Instrumentals,Alternative Rock x Grunge Cold,Gm,110.67,5
Rock Instrumentals,Rock Instrumentals,BMTH x Modern Rock Metal Instrumental Sail (Prod IOF) @prodbyiof,Cm,140.00,6
Rock Instrumentals,Rock Instrumentals,Pop Punk x Punk Rock MGK x Jxdn x Sueco Change Pop Punk Instrumental,F,84.50,7
Rock Instrumentals,Rock Instrumentals,Pop Punk MGK Punk Rock Crunch,A,155.00,7
Rock Instrumentals,Rock Instrumentals,Silverstein x Funeral For A Friend Last Words Post Hardcore Instrumental,F,90.00,7
Rock Instrumentals,Rock Instrumentals,Indie Rock x Alternative Rock Take Back,E,85.00,5
Rock Instrumentals,Rock Instrumentals,Deftones x Alternative Rock Quiet Drive Dark Grunge Instrumental,D,80.00,6
Rock Instrumentals,Rock Instrumentals,80 East 93feetofsmoke x Fatse ,A#m,86.00,6
Rock Instrumentals,Rock Instrumentals,Hardcore x Pop Punk x A Day To Remember,C,87.50,7
Rock Instrumentals,Rock Instrumentals,Pop Punk Rock Solitude,G,85.01,7
Rock Instrumentals,Rock Instrumentals,Pop Punk Rock Vibe,A,80.50,7
Rock Instrumentals,Rock Instrumentals,MGK Pop Punk Rock Sueco x Avril Lavignmo Sad Story (Prod @GAXILLICSx IOF),A#,95.00,6
Rock Instrumentals,Rock Instrumentals,Knocked Loose x The Acacia Strain Worm Fooeathcore Metal Instrumental,Bm,88.49,8
Rock Instrumentals,Rock Instrumentals,surf rock emo pop punk instrumental king of the beach,E,90.50,7
Rock Instrumentals,Rock Instrumentals,Avril Lavigne x MGK Pop Punk x Punk Rock x Paramore Guitar FU (Prod IOF),G,87.52,7
Rock Instrumentals,Rock Instrumentals,Pop Punk MGK x Paramore Post Rock Last Breath (Prod alexanderbierk x IOF),Am,149.00,6
Rock Instrumentals,Rock Instrumentals,hawthorne heights x silverstein lovers emo rock instrumental,E,79.50,7
Rock Instrumentals,Rock Instrumentals,filA drivethru fight TRAP REMIX You Gon Do Somethin,Em,84.95,6
Rock Instrumentals,Rock Instrumentals,Glaive x Ericdoa x Hyperpop Bad Habits,D#m,84.15,6
Rock Instrumentals,Rock Instrumentals,Pop Punk Rock x Hyperpunk Rock Issues,D#,120.00,8
Rock Instrumentals,Rock Instrumentals,BMTH x Trippie Redd x MGK Punk Rock Metal Instrumental Sink (Prod IOF) @prodbyiof,Bm,153.00,6
Rock Instrumentals,Rock Instrumentals,Metalcore x Melodic Post Hardcore DARK HORSE Melodic Metalcore Instrumental,G#m,130.99,7
Rock Instrumentals,Rock Instrumentals,Pop Punk Rock Guitar Loop Kit Sample Pack (prod LIVING PUFF),Am,127.04,3
Rock Instrumentals,Rock Instrumentals,Lil Peep Sad Acoustic G,B,82.06,3
Rock Instrumentals,Rock Instrumentals,Pop Punk x Punk Rock MGK x Iann Dior Highway (Prod IOF x King Theta),E,83.00,6
Rock Instrumentals,Rock Instrumentals,Lil Pump x Smokepurpp ft Dababy ED ,Cm,155.65,5
Rock Instrumentals,Rock Instrumentals,Metalcore x BMTH x Asking Alexandria Metal DOOM,Cm,81.51,5
Rock Instrumentals,Rock Instrumentals,lil lotuscoldhartnedarb (produser67 x lilsp00k),D,145.00,6
Rock Instrumentals,Rock Instrumentals,BMTH x Architects x Bad Omens x Modern Rock Ana,Cm,140.00,7
Rock Instrumentals,Rock Instrumentals,21 Savage x Drake SHADOWS ,Bm,150.00,5
Rock Instrumentals,Rock Instrumentals,Pop Punk Trap x Scorey x MGK Metal Punkstars (Prod IOF x Curtains),Em,85.00,7
Rock Instrumentals,Rock Instrumentals,Pop Punk x Punk Rock MGK x Iann Dior Cloud Nine (Prod IOF),Dm,126.00,6
Rock Instrumentals,Rock Instrumentals,Metalcore x BMTH x Paramore Asking Alexandria Rock Metal METEO,Cm,82.50,6
Rock Instrumentals,Rock Instrumentals,MGK Pop Punk x Punk Rock x Sueco Homesick (Prod Cruxx x IOF),C,104.98,7
Rock Instrumentals,Rock Instrumentals,Pop Punk x Punk Rock MGK x Jxdn x Travis Barker Magnolia,E,97.50,7
Rock Instrumentals,Rock Instrumentals,"Alternative Rock Grunge, Emo Rock Zero",D,140.00,6
Rock Instrumentals,Rock Instrumentals,Metalcore x Post Hardcore VAMPIRE BMTH x Asking Alexandria ,D#m,85.00,7
Rock Instrumentals,Rock Instrumentals,Pop Punk x Punk Rock MGK x Iann Dior Skywalker (Prod IOF x King Theta),D,125.01,6
Rock Instrumentals,Rock Instrumentals,Metalcore x BMTH LEVEL 94 Melodic Hardcore x Hard Pop Punk Instrumental ,B,80.00,7
Rock Instrumentals,Rock Instrumentals,MGK Pop Punk Indie Alternative Rock Sober (Prod IOF),A,155.00,6
Rock Instrumentals,Rock Instrumentals,Pop Punk x Alternative Rock MGK Iann Dior Too Late (Prod Wolevsky x IOF),G,135.00,5
Rock Instrumentals,Rock Instrumentals,Sad Emotional Guitar No Drums CLOUD 9 MGK x Sueco Emo Melodic Guitar,A,140.01,4
Rock Instrumentals,Rock Instrumentals,midwest emo pop punk instrumental i ll never forget you,B,83.00,5
Rock Instrumentals,Rock Instrumentals,fall out boy emo pop punk instrumental from under your grave,A#,87.07,7
Rock Instrumentals,Rock Instrumentals,Acoustic Guitar Country,G,95.00,4
Rock Instrumentals,Rock Instrumentals,TDWP x Asking Alexandria Curse Metalcore Instrumental,Dm,94.00,7
Rock Instrumentals,Rock Instrumentals,BMTH x Bad Omens x Architects x Metal Misery,Am,140.00,6
Rock Instrumentals,Rock Instrumentals,MGK x YUNGBLUD x Blackbear Pop Punk x Punk Rock Anxiety (Prod @Polars x IOF),G,120.00,6
Rock Instrumentals,Rock Instrumentals,Sad Acoustic Guitar The Kid LAROI Pop No Drums Dont Worry (Prod IOF),B,92.04,3
Rock Instrumentals,Rock Instrumentals,Miss May I x As Blood Runs Black Incarnate Metalcore Deathcore Instrumental,Cm,129.99,7
Rock Instrumentals,Rock Instrumentals,J Cole x Mac Miller R&B DOM R&B Instrumental ,G#m,79.99,4
Rock Instrumentals,Rock Instrumentals,Emotional Sad Piano Oli,E,107.05,3
Rock Instrumentals,Rock Instrumentals,MGK x jxdn x Pop Punk x Emo Rock EMXGIRL,E,82.50,8
Rock Instrumentals,Rock Instrumentals,Pop Punk x Punk Rock MGK x Iann Dior Goodbye (Prod IOF x Sol),F#,92.00,7
Rock Instrumentals,Rock Instrumentals,emo rap scenecore I like you too,B,83.58,3
Rock Instrumentals,Rock Instrumentals,Post Malone x Tyga ft GEazy HAUNTED ,Cm,84.94,5
Rock Instrumentals,Rock Instrumentals,Indie Rock x Bedroom Pop Strange,D,85.50,4
Rock Instrumentals,Rock Instrumentals,Fi,F#m,80.00,4
Rock Instrumentals,Rock Instrumentals,Hyperpop x Glaive x 100 Gecs Pop Punk Faultline,A,155.89,6
Rock Instrumentals,Rock Instrumentals,Escape The Fate x Silverstein Widow Post Hardcore Instrumental,Dm,98.08,7
Rock Instrumentals,Rock Instrumentals,Pop Punk x Punk Rock MGK x Poorstacy Unloved (Prod alexanderbierk x IOF),Bm,82.50,7
Rock Instrumentals,Rock Instrumentals,Pop Punk x Punk Rock MGK x Blink 182 Nevermind (Prod @Polars x IOF),D,133.00,7
Rock Instrumentals,Rock Instrumentals,Pop Punk x Punk Rock MGK x Iann Dior Miss You (Prod IOF),A,126.01,6
Rock Instrumentals,Rock Instrumentals,Pop Punk x Punk Rock Iann Dior x MGK So Wrong (Prod IOF),D,131.99,7
Rock Instrumentals,Rock Instrumentals,PARAMORE x POP PUNK (Lil Aaron) MISERY BUSINESS proead Yami,Fm,156.20,6
Rock Instrumentals,Rock Instrumentals,Pop x Guitar x Pop RnB Instrumental Puff,Bm,152.99,5
Rock Instrumentals,Rock Instrumentals,Linkin Park Hollywood Undead Cyberpunk Hard Rock,Em,94.90,7
Rock Instrumentals,Rock Instrumentals,Metalcore x Melodic Hardcore BATTLEGROUND Melodic PostHardcore Instrumental,Am,135.00,7
Rock Instrumentals,Rock Instrumentals,Pop Punk x Punk Rock MGK x Iann Dior Had Enough (Prod IOF x Sol),Bm,152.00,7
Rock Instrumentals,Rock Instrumentals,MGK x jxdn x Modern Rock x Synth Rock We didnt escape,B,120.00,8
Rock Instrumentals,Rock Instrumentals,MGK x Nothing Nowhere Pop Punk True Love Pop Punk Instrumental,D,140.00,7
Rock Instrumentals,Rock Instrumentals,BMTH x Bad Omens x Architects x Metal Alone,Am,150.00,7
Rock Instrumentals,Rock Instrumentals,BMTH x Linkin Park x Paramore x Metalcore Nemesis (Prod Kala x IOF),Bm,150.07,7
Rock Instrumentals,Rock Instrumentals,Pop Punk x Emo Rock Firefly,D#m,84.00,7
Rock Instrumentals,Rock Instrumentals,Pop Punk Rock Waves,G,151.00,6
Rock Instrumentals,Rock Instrumentals,Emo Rock x Pop Punk MGK Leaving (Prod @GAXILLICSx IOF),E,80.00,6
Rock Instrumentals,Rock Instrumentals,Indie Rock x Aldn x Aries x Hyperpop Promise,G,118.00,7
Rock Instrumentals,Rock Instrumentals,I See Stars x Scary Kids Scaring Kids Starship Post Hardcore,F#m,85.05,7
Rock Instrumentals,Rock Instrumentals,Metalcore x Post Hardcore DEADLIGHTS BMTH x INK Heavy Breakdown,C#m,96.00,8
Rock Instrumentals,Rock Instrumentals,alternative rock shoegaze pop punk instrumental 1992 ,C,88.50,7
