Artist,Album,Title,Key,BPM,Energy
2001,2001,Kurt Cobain x Lil Peep x Brennan Savageie young Prod 2001,Bm,102.52,5
2001,2001,Fatse x 93feetofsmoke x shinigami Clarity Prod 2001,C,140.00,5
2001,2001,Shrimp Cloud Rap Worth Prod 2001,C,130.00,5
2001,2001,9TAILS x guardin x Lil Peep x sadeyes CHOSEN Prod 2001,Am,120.00,4
2001,2001,Guardin x Cold Hart Miss Me Prod 2001,F#m,130.01,3
2001,2001,shinigami x boy pablo x guardin x indie rock COLD Prod 2001,G,115.00,6
2023,2023,Lil Uzi Vert xarkboyrift (Prod Byarkboy),Em,122.00,6
2023,2023,alaskan,E,137.00,5
2023,2023,hyperpop brakence + emo drill habibati,D,145.01,6
2023,2023,nosense,C#m,153.99,4
2023,2023,drain gang + bladee + d1v (jolst + internet joe),Dm,140.00,4
2023,2023,Abyss,Cm,93.00,4
2023,2023,juice wrld x loesoe ambient waking dream,Cm,139.00,6
2023,2023,last breath,F#,92.50,7
2023,2023,No Tag whitearmor x umru x bladee l rywuna0ra,D#m,105.99,4
2023,2023,NEONREAMS,G#m,80.00,5
2023,2023,SAD midwxst x glaive x hyperpopelete You,Am,82.00,5
2023,2023,one day,Dm,140.00,5
2023,2023,code,Dm,85.99,7
2023,2023,serene,Dm,81.00,5
2023,2023,hyperpop glaive + ericdoa wish me luck,A,131.99,4
2023,2023,bubbles,D#,140.00,6
2023,2023,over it,F#,139.00,4
2023,2023,ECCO2K x BLADEE x BLACK KRAY RAINFALL prod shinju,Em,140.00,5
2023,2023,midwxst x glaive x hyperpop Your Boy,F#m,152.00,4
2023,2023,Ill be waiting,D,150.01,6
2023,2023,darkknight,G#m,141.00,5
2023,2023,saber,Em,135.00,5
2023,2023,blizzard,F,144.00,5
2023,2023,Hyperpop Glaive x Brakence Pop Punk Guitar Sleepy,E,140.00,6
2023,2023,BLADEE x BLACK KRAY x THAIBOYIGITAL REPAIR prod shinju,D#m,157.00,5
27club,Sticks & Stones,Grab the Wheel,G#m,144.00,7
31knots,The Days and Nights of Everything Anywhere,Savage Boutique,Am,116.75,5
4evr,Cold,Cold,A#m,140.02,6
5head,5head,Blurred Lines Nothingnowhere,D,120.00,5
5head,5head,U Never Bothered,F,150.00,5
5head,5head,Hollow Emo,A#,103.33,6
5head,5head,Lights Out Emo Guitar,Gm,150.00,6
5head,5head,Cupid Juice Wrld,C#,157.00,6
5head,5head,Vanity Nothing Nowhere,Dm,80.00,5
5head,5head,Flowers,Fm,82.50,6
6obby,Elegance.,Nobody,C#m,80.00,5
808 Trel,,[FREE] Bryson Tiller x 6LACK Type Beat 'Forever',D#,152.00,5
93feetofsmoke,Nightmare,Oh Nah Oh Nah,E,81.00,7
93punx & Vic Mensa Feat. Good Charlotte,93punx,It’s a Bad Dream,Bm,82.00,7
A Change of Pace,Rockin' Romance,Summer Girls,E,100.00,7
A Great Big Pile of Leaves,The Fiery Works,Mystery of the Brain,G,142.99,8
A Lot Like Birds,Conversation Piece,A Satire of a Satire of a Satire Is Tiring,F#m,114.00,6
A Thorn for Every Heart,Punk Goes 80's,Dead Man's Party,D#m,87.50,7
A War Within,Kingdom Leaks: Covers Compilation Vol. Iii,Rude (Magic),C#,144.00,7
A.I.(D),Djent Rolls Deep,Eminem,Bm,139.72,7
Abbott Hayes,"Pacific Ridge Records Presents: A Tribute to Blink-182, Volume 2",I Miss You,B,109.50,5
Above the Fallen,Make It Stop,Memories,Bm,149.98,7
Ace Enders and a Million Different People,When I Hit the Ground,When I Hit the Ground,A#,139.99,6
Acoustic Aquatic,,"[FREE] Acoustic Guitar Type Beat - ""the little things""",G,153.99,3
Acres,In Sickness & Health,In Sickness & Health,G#m,110.00,5
Adventure,"Tales of Belle, Part 1: Across the Ocean",Voices,Bm,150.00,7
Adventure Club,B-Sides,Kaboom,Cm,139.99,7
Adventure Club,B-Sides,Need Your Heart 2.0 (Adventure Club X Dion Timmer X Kai),D#m,150.00,7
Adventure Club,B-Sides,Life Long After Death,Em,150.00,7
Adventure Club,Do I See Color,Do I See Color,Am,146.00,8
Adventure Club,Next Life (Remixes),Yehme2 Remix,Em,152.00,7
Adventure Club,Leviathan,Leviathan,Fm,150.00,8
Adventure Club,Red // Blue,Without You,Em,145.00,6
Adventure Club,Red // Blue,Ghosts,A#m,155.00,5
Adventure Club,Red // Blue,Goodnight,E,114.99,3
Adventure Club,Calling All Heroes,Thunderclap,Fm,128.00,8
Adventure Club,B-Sides,"Some Will Seek Forgiveness, Others Escape",Bm,140.01,5
Adventure Club,Love // Chaos,Here,G,110.00,7
Adventure Club,The Death or Glory Sessions,Death or Glory,Fm,150.01,7
Adventure Club,Wait,Wait,G,128.00,7
Adventure Club,Next Life,Byo,Em,126.00,7
Adventure Club,Next Life,Mom,Em,100.00,8
Adventure Club,Red // Blue,Without You,Em,145.00,6
Adventure Club,B-Sides,Hurricane,Am,81.50,7
Adventure Club,Wait,Wait,G,128.00,7
Adventure Club,Next Life (Remixes),Byor Remix,Em,126.00,7
Adventure Club,Retro City,01retro City,Fm,93.37,7
Adventure Club,Spiritus Sancti (Boondock Saints Tribute),Spiritus Sancti (Boondock Saints Tribute),A#m,126.39,6
Adventure Club,The Death or Glory Sessions,Wolfpack,Fm,150.00,7
Adventure Club,Red // Blue,Save Me,Fm,140.00,8
Adventure Club,Life Long After Death,Life Long After Death,Em,150.00,7
Adventure Club,Next Life,Yeh,Em,152.00,7
Adventure Club,Red // Blue,Crash 2.0 (Adventure Club Vs. Dallask),Cm,128.00,7
Adventure Club,Next Life (Remixes),Mom N Dad Remix,Em,100.00,8
Adventure Club,Red // Blue,Save Me,Fm,140.00,8
Adventure Club,Calling All Heroes,Crash,Cm,110.00,8
Adventure Club & Alrt,Love // Chaos,Away From Myself,Am,150.00,7
Adventure Club & Beauz Feat. Tilian Pearson,Love // Chaos,Drive,D,150.01,7
Adventure Club & Beauz Feat. Tilian Pearson,Love // Chaos,Drive,D,150.01,7
Adventure Club & Birthdayy Partyy,Love // Chaos,Move It,Bm,128.00,6
Adventure Club & Blanke Feat. Becca Krueger,Love // Chaos,Still Awake,A,80.00,6
Adventure Club & Boss Mode Feat. Kindred,Love // Chaos,Infinity,Fm,150.00,7
Adventure Club & Cabuizee Feat. Gion,Love // Chaos,Stuck,Em,154.00,7
Adventure Club & Codeko Feat. Sarah De Warren,Love // Chaos,Never Surrender,Cm,150.00,8
Adventure Club & Codeko Feat. Sarah De Warren,Love // Chaos,Never Surrender,Cm,150.00,8
Adventure Club & Crankdat Feat. Krewella,Love // Chaos,Next Life,Em,142.00,7
Adventure Club & David Solano Feat. Zak Waters,Unleash (Life in Color Anthem 2014),Unleash (Life in Color Anthem 2014),C#m,128.00,8
Adventure Club & David Solano Feat. Zak Waters,Unleash (Life in Color Anthem 2014),Unleash (Life in Color Anthem 2014) (Radio Edit),C#m,128.00,8
Adventure Club & Gspr Feat. Boy Apocalypse,Love // Chaos,All In,D#,149.00,6
Adventure Club & Kaivon,Love // Chaos,You’ll Never Be Alone,G,128.00,7
Adventure Club & Lucii,Love // Chaos,Stronger,G#m,150.00,7
Adventure Club & Modern Machines,Love // Chaos,Never Enough,Am,82.55,6
Adventure Club & Nurko Feat. Dayseeker,Love // Chaos,Colorblind,Dm,139.99,6
Adventure Club & Nurko Feat. Dayseeker,Love // Chaos,Colorblind,Dm,139.99,6
Adventure Club & Nurko Feat. Dayseeker,Love // Chaos,Colorblind,Dm,139.99,6
Adventure Club & Outwild Feat. Kotomi,Love // Chaos,One More Try,A,152.00,5
Adventure Club & Prince Fox Feat. Justin Jesso,Love // Chaos,Come Clean,C,135.02,5
Adventure Club & Said the Sky Feat. Caly Bevier,Love // Chaos,Already Know,Am,140.00,6
Adventure Club & Said the Sky Feat. Caly Bevier,Love // Chaos,Already Know,Am,140.00,6
Adventure Club & Said the Sky Feat. Caly Bevier,Love // Chaos,Already Know,Am,140.00,6
Adventure Club & Sharps,Love // Chaos,Lonely,Dm,144.99,7
Adventure Club & Soar Feat. Luma,Love // Chaos,Safe With Me,F#m,150.00,7
Adventure Club & Soar Feat. Luma,Love // Chaos,Safe With Me,F#m,150.00,7
Adventure Club & Squired Feat. Dia Frampton,Love // Chaos,High Like This,Cm,150.00,6
Adventure Club & Squired Feat. Dia Frampton,Love // Chaos,High Like This,Cm,150.00,6
Adventure Club & Squired Feat. Dia Frampton,Love // Chaos,High Like This,Cm,150.00,6
Adventure Club Feat. Ben Stevenson,Red // Blue,Forever,A#m,128.00,6
Adventure Club Feat. Cammie Robinson,Love // Chaos,Broken Love,Am,80.00,7
Adventure Club Feat. Cammie Robinson,Love // Chaos,Broken Love,Am,80.00,7
Adventure Club Feat. Delaney Jane,Red // Blue,Limitless,Cm,80.00,8
Adventure Club Feat. Elea,Red // Blue,Dreams,Am,95.00,7
Adventure Club Feat. Elea,Red // Blue,Dreams,Am,95.00,7
Adventure Club Feat. Kai,Need Your Heart: The Remixes,Need Your Heart,Cm,140.00,7
Adventure Club Feat. Kai,Need Your Heart,Need Your Heart,Cm,140.00,7
Adventure Club Feat. Kai,Need Your Heart: The Remixes,Need Your Heart (Cry Wolf Remix),Cm,130.00,8
Adventure Club Feat. Kai,Need Your Heart: The Remixes,Need Your Heart (Candyland Remix),Cm,128.00,8
Adventure Club Feat. Kai,Need Your Heart: The Remixes,Need Your Heart (Protohype Remix),Cm,140.00,7
Adventure Club Feat. Kai,Need Your Heart,Need Your Heart,Cm,140.00,7
Adventure Club Feat. Kai,Need Your Heart: The Remixes,Need Your Heart (Minnesota Remix),Cm,145.00,7
Adventure Club Feat. Krewella,Rise & Fall,Rise & Fall,Fm,140.00,8
Adventure Club Feat. Krewella,Rise & Fall,Rise & Fall,Fm,140.00,7
Adventure Club Feat. Krewella,Rise & Fall,Rise & Fall,Fm,140.00,7
Adventure Club Feat. Krewella,Rise & Fall,Rise & Fall,Fm,140.00,8
Adventure Club Feat. Leah Culver,Red // Blue,Reaction,Em,112.00,8
Adventure Club Feat. Sara Diamond,Love // Chaos,Back to You,Bm,150.01,6
Adventure Club Feat. Sara Diamond,Love // Chaos,Back to You,Bm,150.01,6
Adventure Club Feat. Sara Diamond,Red // Blue,Firestorm,C#m,140.01,6
Adventure Club Feat. Sara Diamond,Red // Blue,Firestorm,C#m,140.01,6
Adventure Club Feat. Sondar,Red // Blue,Breathe,C#m,150.00,6
Adventure Club Feat. The Kite String Tangle,Calling All Heroes,Wonder,Gm,123.00,7
Adventure Club Feat. The Kite String Tangle,Calling All Heroes,Wonder,Gm,123.00,7
Adventure Club Feat. Yuna,Love // Chaos,Rebellious,Cm,80.00,6
Adventure Club Feat. Yuna,Calling All Heroes,Gold,Am,145.00,6
Adventure Club Feat. Yuna,Love // Chaos,Rebellious,Cm,80.00,6
Adventure Club Feat. Yuna,Calling All Heroes,Gold,Am,145.00,6
Adventure Club Feat. Yuna,Calling All Heroes,Gold,Am,145.00,7
Adventure Club Feat. Zak Waters,Red // Blue,Fade,Bm,134.00,8
Adventure Club Vs Dallask,Crash 2.0,Crash 2.0,D#,128.00,8
Adventure Club X Crankdat Feat. Krewella,Next Life,Next Life,Em,142.00,7
Adventure Club X Modern Machines Feat. Saint Slumber,Makedamnsure,Makedamnsure,Bm,155.00,6
Adventure Club X Modern Machines Feat. Saint Slumber,Makedamnsure,Makedamnsure,Bm,155.00,6
Adventure Club X Said the Sky Feat. Caly Bevier,Already Know (Cinematic Remix),Already Know (Cinematic Remix),Am,150.00,7
"Adventure Club, Armnhmr & Haliene",Love // Chaos,Anywhere,D,130.00,6
"Adventure Club, Fancy Monster & Soundr",Love // Chaos,King of Nothing,D#,150.00,6
After Hour Animals,All It Takes,All It Takes,Fm,103.28,7
Ag128et,Yt Mashups,One More Heart Attack (Mashup),Fm,86.99,7
Ahnboi,Ahnboi,Sad Nothing [Piano Instrumental ],B,145.00,6
Ahnboi,Ahnboi,Sad Juice WRLD Pain,A#m,82.50,5
Ahnboi,Ahnboi,Sad Piano Mistakes,F#m,130.00,3
Ahnboi,Ahnboi,I Was Good to You,F#m,155.00,4
Ahnboi,Ahnboi,Roddy Ricch x Gunna Bleak [Prod hnboi x Sandrey],Dm,120.00,5
Ahnboi,Ahnboi,Sad Juice WRLDreamz,Dm,155.00,5
Ahnboi,Ahnboi,Juice WRLD x Lil Skiesgony,A#m,81.00,5
Ahnboi,Ahnboi,Polox Lil Tjay My Time,Gm,95.00,4
Ahnboi,Ahnboi,Lil Peep Rich & Sad,G#m,110.00,5
Ahnboi,Ahnboi,Sad Oneay,D#,125.00,3
Ahnboi,Ahnboi,Sad Chill Lose Myself,F,128.74,3
Ahnboi,Ahnboi,Sad Trap Strangers,F#,148.03,3
Ahnboi,Ahnboi,XXXTENTACION x Lil Peep Hurt,Am,148.03,5
Ahnboi,Ahnboi,Sad Ieel Empty,A,134.01,5
Aiden,Some Kind of Hate,In the End,A#m,107.00,6
Aim High,Local Band Forever,Gender Neutral Happy Meal (Feat. Belmont & Safehold),D,124.00,8
Aim High,Local Band Forever,Drag This Out (Feat. In Her Own Words),F,80.00,6
Aim High,Local Band Forever,Home Is Where the Hea(R)T Is[Feat. Sleeping With Sirens & Like Pacific],Fm,140.00,7
Aim High,Local Band Forever,Pajamas in Public (Feat. Reliance),Fm,115.63,7
Aim High,Local Band Forever,Eton Edicius (Feat. Safehold),G#,95.00,7
Aim High,Local Band Forever,Clear & Concise (Feat. Glimmers),G,145.01,6
Aim High,Local Band Forever,Penny Lane (Feat. Wilmette),Cm,124.82,7
Aim High,Local Band Forever,$Ezcore$ (Feat. Charlie Sheen & Dan O'connor),D#,126.38,7
Aim High,Local Band Forever,Counterparts (Feat. Brendan Murphy & Lindsay Lohan),Fm,124.68,7
Aim High,Local Band Forever,Here Lies Kakarot's Hopes & Dreams(Feat. The Home Team & Donnell Rawlings),Fm,87.50,7
Aim High,Local Band Forever,Empty Streets (Feat. Driveways),Dm,98.00,7
Aim High,Local Band Forever,Better Than This (Feat. Broadside & Soulja Boy)),Cm,117.00,7
Air Dubai,Love Is Hopeless... 2013,Toxic,Gm,102.00,4
AIRAVATA,AIRAVATA,Juice WRLD x Iannior Clarity (Prod byIRAVATA),G#m,109.00,4
AIRAVATA,AIRAVATA,Post Malone x NAV Hollywood (Prod byIRAVATA),D#,130.80,3
AIRAVATA,AIRAVATA,NAV x Post Malone Starstruck (Prod byIRAVATA),F#m,135.20,3
AIRAVATA,AIRAVATA,NAV x Post Malonerift (Prod byIRAVATA),Fm,102.60,5
AIRAVATA,AIRAVATA,Lil Peep x Juice WRLD Visions (Prod byIRAVATA),C,80.86,6
AIRAVATA,AIRAVATA,NAV x Post Malone Gone (Prod byIRAVATA),A#,134.92,3
AIRAVATA,AIRAVATA,6lack x Juice WRLD x Kevin George Love Letter (Prod byIRAVATA x Omari Jr ),Gm,132.00,4
AIRAVATA,AIRAVATA,Post Malone x NAV Let Youown (Prod byIRAVATA),F#m,120.00,4
AIRAVATA,AIRAVATA,Gunna x Juice WRLDifferent Colors (Prod byIRAVATA),C#m,79.10,4
AIRAVATA,AIRAVATA,Trippie Redd x J Cole Levitate (Prod byIRAVATA),Cm,90.00,3
AIRAVATA,AIRAVATA,Post Malone x Juice WRLDall (Prod byIRAVATA),Gm,147.12,4
AIRAVATA,AIRAVATA,NAV xftertheparty Invisible (Prod byIRAVATA),A#m,130.24,3
AIRAVATA,AIRAVATA,NAV xuture x Post Malone Pluto (Prod byIRAVATA)m,D#m,140.00,4
Alan Braxe & Fred Falke,Intro,Intro (Original Club Mix),Fm,104.98,8
Alan Braxe & Fred Falke,Intro,Intro (Original Club Mix),Fm,140.02,7
ALEX COLLINS,ALEX COLLINS,Lil Uzi Vert x Juice WRLD MONEY UP Emo Guitar Trap ,Dm,154.93,4
ALEX COLLINS,ALEX COLLINS,Lil Tjay x Polo No Trustt Roddy Ricch ,Em,124.00,5
ALEX COLLINS,ALEX COLLINS,Lost Lil Peep (Type Beat),F#,150.07,7
ALEX COLLINS,ALEX COLLINS,Juice Wrld x Lil Skies BLACKHOLEt OliverrancisLEX COLLINS,F#m,155.00,4
ALEX COLLINS,ALEX COLLINS,Chelsea Cutler x The Chainsmokers Over You (Type Beat)LEX COLLINS,F,101.95,5
ALEX COLLINS,ALEX COLLINS,The Chainsmokers VAIL (Prod lex Collins),Am,99.98,6
ALEX COLLINS,ALEX COLLINS,The Only Rihanna xuture (Type Beat) G,G#,93.01,5
ALEX COLLINS,ALEX COLLINS,Chainsmokers x Ex Zedd Move OnLEX COLLINS,F#m,149.95,6
ALEX COLLINS,ALEX COLLINS,Post Malone x Lil Skiesakes (Type Beat)LEX COLLINS,A#,150.14,5
ALEX COLLINS,ALEX COLLINS,Lost Love The Chainsmokers (Type Beat)LEX COLLINS,G,100.18,6
ALEX COLLINS,ALEX COLLINS,Juice WRLD x Nick Mira VoicesLEX COLLINS,C#m,153.00,5
ALEX COLLINS,ALEX COLLINS,Juice WRLD x Lil Peep LOST WO ULEX COLLINS G,G#,150.00,5
Alexisonfire,To a Friend (Adventure Club Remix),To a Friend (Adventure Club Remix),G,140.05,6
All Time Low,A Tribute to Blink 182 (Pacific Ridge Records Heroes of Pop Punk),Time to Break Up,C#,100.00,6
All Time Low,Love Is Hopeless... 2013,True Colors,A,95.00,7
Allister,Welcome to the Family,Somewhere Down in Fullerton,D#,95.02,7
Allister,Welcome to the Family,Stuck,G#,96.23,7
Allister,Last Stop Suburbia,Somewhere on Fullerton,D#,97.00,7
Aloha,Light Works,Body Buzz,G,124.99,5
Alpine Loop,Country Goes Hardcore,Red,E,142.00,7
Alter Ego,"Pacific Ridge Records Presents: A Tribute to Blink-182, Volume 2",Carousel,B,80.46,7
Alteras,Kingdom Leaks: Covers Compilation Vol. Iii,Timber (Pitbull),B,130.01,6
American Football,American Football,Never Meant,C,144.16,5
Anarbor,The Words You Don’t Swallow,Useless,C#,95.01,6
Andrew Tran,Soundcloud 2018,Typhlosion,C#m,143.97,5
Andrew Zink of Akeldama,Djent Rolls Deep,Dangerous (Busta Rhymes),Em,103.11,7
Andyr,Andyr,Juice WRLD xuture x Iannior Tied Up (prod ndyr),Fm,143.00,4
Andyr,Andyr,Roddy Ricch x Juice WRLD x Lil Uzi Vert Promise (prod ndyr),Fm,140.00,4
Andyr,Andyr,Juice WRLD x Lilurk x Lil Uzi Vert Lesson (prod ndyr x datboigetro)m,D#m,138.00,4
Andyr,Andyr,[GUITAR] Juice WRLD x Iannior x Lil Uzi Vert Now I Know (prod ndyr),Bm,155.99,5
Andyr,Andyr,Future x Juice WRLD x Trippie Reddeel It (prod ndyr),Gm,153.00,4
Anthem Lights,Yt Mashups,Emo Medley,C,116.48,4
Antoine Dufour,Convergences,En T'attendant,E,140.15,3
Anton Golden,Fuck Playlist,Narcissistic Drama Queen,Dm,112.00,4
Any Given Day,Kingdom Leaks: Covers Compilation Vol. Iii,Diamonds (Rihanna),Bm,92.00,7
Architects,For Those That Wish To Exist,Discourse Is Dead,Cm,124.00,7
Architects,Holy Hell,Mortal After All,F#m,154.00,7
Architects,For Those That Wish To Exist At Abbey Road,Dying Is Absolutely Safe (Abbey Road Version),Cm,115.02,4
Architects,Holy Hell,A Wasted Hymn,F#m,121.00,5
Architects,All Our Gods Have Abandoned Us,From The Wilderness,F#m,124.14,4
Architects,For Those That Wish To Exist,Dead Butterflies,D#m,125.00,5
Architects,For Those That Wish To Exist,Goliath (feat. Simon Neil),C#m,148.00,7
Architects,Holy Hell,Holy Hell,Bm,105.00,6
Architects,Holy Hell,Royal Beggars,Bm,89.00,5
Architects,All Our Gods Have Abandoned Us,Memento Mori,G#m,95.00,6
Architects,Holy Hell,Doomsday,F#m,125.00,6
Architects,For Those That Wish To Exist,Demi God,Bm,122.00,6
Architects,Holy Hell,The Seventh Circle,C#m,90.00,7
Architects,For Those That Wish To Exist,Animals,C#m,95.00,7
Architects,All Our Gods Have Abandoned Us,Phantom Fear,G#m,136.66,6
Architects,For Those That Wish To Exist At Abbey Road,Flight Without Feathers (Abbey Road Version),A#m,135.00,5
Architects,All Our Gods Have Abandoned Us,A Match Made In Heaven,F#m,121.50,7
Architects,Holy Hell,Damnation,G#m,87.50,7
Architects,For Those That Wish To Exist,Meteor,C#m,136.00,6
Architects,Holy Hell,Hereafter,F#m,121.00,6
Architects,For Those That Wish To Exist At Abbey Road,Demi God (Abbey Road Version),Bm,122.00,7
Architects,For Those That Wish To Exist At Abbey Road,An Ordinary Extinction (Abbey Road Version),G#m,103.50,5
Architects,For Those That Wish To Exist,Giving Blood,C#m,137.00,6
Architects,For Those That Wish To Exist At Abbey Road,Meteor (Abbey Road Version),C#m,136.00,6
Architects,For Those That Wish To Exist At Abbey Road,Dead Butterflies (Abbey Road Version),D#m,125.00,6
Architects,All Our Gods Have Abandoned Us,The Empty Hourglass,G#m,88.09,5
Architects,For Those That Wish To Exist At Abbey Road,Little Wonder (Abbey Road Version),C#m,130.00,6
Architects,For Those That Wish To Exist At Abbey Road,Discourse Is Dead (Abbey Road Version),Cm,124.00,7
Architects,All Our Gods Have Abandoned Us,Downfall,F#m,120.00,6
Architects,All Our Gods Have Abandoned Us,Gravity,G#m,87.50,6
Architects,All Our Gods Have Abandoned Us,Nihilist,G#m,120.01,6
Architects,Holy Hell,Modern Misery,G#m,116.00,6
Architects,For Those That Wish To Exist,An Ordinary Extinction,G#m,138.00,6
Architects,All Our Gods Have Abandoned Us,All Love is Lost,G#m,120.00,5
Architects,For Those That Wish To Exist,Libertine,C#m,145.00,6
Architects,For Those That Wish To Exist,Black Lungs,D#m,90.50,7
Architects,For Those That Wish To Exist At Abbey Road,Giving Blood (Abbey Road Version),C#m,137.00,6
Architects,For Those That Wish To Exist,Do You Dream Of Armageddon?,D#m,125.00,4
Architects,All Our Gods Have Abandoned Us,Deathwish,G#m,120.00,7
Architects,For Those That Wish To Exist,Dying Is Absolutely Safe,Cm,114.99,4
Architects,For Those That Wish To Exist,Impermanence (feat. Winston McCall),G#m,87.00,7
Architects,Holy Hell,Death is Not Defeat,G#m,95.00,6
Architects,For Those That Wish To Exist At Abbey Road,Animals (Abbey Road Version),C#m,95.00,7
Architects,For Those That Wish To Exist At Abbey Road,Black Lungs (Abbey Road Version),D#m,90.50,6
Architects,For Those That Wish To Exist At Abbey Road,Goliath (Abbey Road Version),C#m,148.00,6
Architects,For Those That Wish To Exist,Flight Without Feathers,A#m,134.99,6
Architects,All Our Gods Have Abandoned Us,Gone With The Wind,F#m,155.00,7
Architects,Holy Hell,Dying to Heal,G#m,95.00,6
Architects,For Those That Wish To Exist At Abbey Road,Libertine (Abbey Road Version),C#m,145.00,6
Architects,For Those That Wish To Exist At Abbey Road,Do You Dream Of Armageddon? (Abbey Road Version),D#m,125.03,3
Architects,For Those That Wish To Exist At Abbey Road,Impermanence (Abbey Road Version),C#m,87.00,7
Architects,For Those That Wish To Exist,Little Wonder (feat. Mike Kerr),C#m,130.00,7
Architecture in Helsinki,Before You Go,Debbie (Cd),B,108.06,6
Arctic Island,Kingdom Leaks: Covers Compilation Vol. III,Dangerous (David Guetta Cover),Em,85.00,7
Arkaeo,"I Could Die, and Nobody Would Notice","I Could Die, and Nobody Would Notice",F,138.01,6
Armor For Sleep,What to Do When You Are Dead (15th Anniversary),Who's Gonna Lie to You,Am,85.00,6
Armor For Sleep,What to Do When You Are Dead (15th Anniversary),Stay on the Ground (Demo),Am,80.08,7
Armor For Sleep,The Way Out Is Broken,Vanished,D,155.00,7
Armor For Sleep,What To Do When You Are Dead,Stay On The Ground,Am,80.04,7
Armor For Sleep,What to Do When You Are Dead (15th Anniversary),Remember to Feel Real,Em,82.38,6
Armor For Sleep,The Way Out Is Broken,This Abyss,C#,87.00,7
Armor For Sleep,Instrumental,Awkward Last Words (Instrumental),G#m,129.91,7
Armor For Sleep,Dream to Make Believe,Kind of Perfect,A,84.00,6
Armor For Sleep,What to Do When You Are Dead (15th Anniversary),Slip Like Space (Demo),F#m,79.55,6
Armor For Sleep,Instrumental,Run Right Back In (Instrumental),D,82.01,7
Armor For Sleep,Smile For Them (Standard Version),Stand in the Spotlight,D,90.00,6
Armor For Sleep,What to Do When You Are Dead (15th Anniversary),Dream to Make-Believe (Demo),Am,150.08,6
Armor For Sleep,Instrumental,"Walking At Night, Alone (Instrumental)",Bm,157.22,6
Armor For Sleep,What to Do When You Are Dead (15th Anniversary),"Walking at Night, Alone",D,157.22,6
Armor For Sleep,What to Do When You Are Dead (15th Anniversary),Never Had the Chance,D,95.00,6
Armor For Sleep,What To Do When You Are Dead,Car Underwater,Bm,148.10,6
Armor For Sleep,Instrumental,Hold the Door (Instrumental),E,82.00,6
Armor For Sleep,Instrumental,Basement Ghost Singing (Instrumental),F#m,133.02,6
Armor For Sleep,Smile For Them (Standard Version),Stars in Your Eyes,Fm,80.00,7
Armor For Sleep,What To Do When You Are Dead,A Quick Little Flight,Em,87.01,5
Armor For Sleep,Dream to Make Believe,Phantoms Now,D,84.00,6
Armor For Sleep,The Way Out Is Broken,The Way Out Is Broken,Bm,112.10,7
Armor For Sleep,Dream to Make Believe,The Wanderers Guild,Am,84.00,6
Armor For Sleep,Dream to Make Believe,Slip Like Space,F#m,82.00,6
Armor For Sleep,What to Do When You Are Dead (15th Anniversary),The More You Talk the Less I Hear,Dm,83.75,6
Armor For Sleep,The Killer In You: A Tribute To Smashing Pumpkins,Today,D#,85.00,6
Armor For Sleep,What to Do When You Are Dead (15th Anniversary),The End of a Fraud,Dm,80.01,5
Armor For Sleep,Instrumental,Know What You Have (Instrumental),B,158.00,6
Armor For Sleep,Dream to Make Believe,Armor for Sleep,F#m,108.02,4
Armor For Sleep,What to Do When You Are Dead (15th Anniversary),Standing Alone,A,84.00,7
Armor For Sleep,Smile For Them (Standard Version),Somebody Else's Arms,Bm,155.00,7
Armor For Sleep,Dream to Make Believe,Wanderers Guild,Am,84.00,6
Armor For Sleep,Instrumental,A Quick Little Flight (Instrumental),Em,87.01,5
Armor For Sleep,Transformers: The Album,End Of The World,Em,80.07,7
Armor For Sleep,Five Song Demo,Dream To Make Believe,Am,150.08,7
Armor For Sleep,What to Do When You Are Dead (15th Anniversary),I Have Been Right All Along,Bm,84.99,7
Armor For Sleep,Smile For Them (Standard Version),Run Right Back In,D,82.01,7
Armor For Sleep,What to Do When You Are Dead (15th Anniversary),Car Underwater (Demo),D,148.00,7
Armor For Sleep,Smile For Them (Standard Version),Smile for the Camera,F#m,82.50,7
Armor For Sleep,Smile For Them (Standard Version),End of the World,Em,80.00,7
Armor For Sleep,Instrumental,The Truth About Heaven (Instrumental),Bm,123.09,6
Armor For Sleep,Smile For Them (Standard Version),Lullaby,A,150.00,7
Armor For Sleep,The Way Out Is Broken,We'll Own the World,C#,156.00,7
Armor For Sleep,What To Do When You Are Dead,The More You Talk The Less I Hear,Dm,83.76,6
Armor For Sleep,Five Song Demo,Slip Like Space,F#m,79.55,6
Armor For Sleep,The Way Out Is Broken,Know What You Have,G#m,158.00,6
Armor For Sleep,Smile For Them (Standard Version),Chemicals,F#m,85.01,7
Armor For Sleep,What to Do When You Are Dead (15th Anniversary),A Quick Little Flight,Em,87.01,5
Armor For Sleep,Dream to Make Believe,My Town,A#,86.00,7
Armor For Sleep,What To Do When You Are Dead,Very Invisible (Bonus Track),F#m,80.01,5
Armor For Sleep,What To Do When You Are Dead,The Truth About Heaven,Bm,92.31,6
Armor For Sleep,Dream to Make Believe,Dream to Make Believe,Am,81.25,6
Armor For Sleep,Safe and Sound - An Isolation Compilation,Basement Ghost Singing (Re-Imagined),F#m,124.01,5
Armor For Sleep,What to Do When You Are Dead (15th Anniversary),Basement Ghost Singing,F#m,133.02,6
Armor For Sleep,What To Do When You Are Dead,I Have Been Right All Along,Bm,84.99,7
Armor For Sleep,What to Do When You Are Dead (15th Anniversary),Awkward Last Words,G#m,129.90,7
Armor For Sleep,What To Do When You Are Dead,Awkward Last Words,G#m,129.90,7
Armor For Sleep,Dream to Make Believe,Frost and Front Steps,F,84.00,7
Armor For Sleep,What to Do When You Are Dead (15th Anniversary),All Warm (Demo),Bm,147.06,7
Armor For Sleep,What to Do When You Are Dead (15th Anniversary),The Truth About Heaven,Bm,92.31,6
Armor For Sleep,What to Do When You Are Dead (15th Anniversary),Always a Wish,D,110.65,6
Armor For Sleep,How Far Apart - Single,How Far Apart,G#m,146.00,7
Armor For Sleep,Instrumental,Lullaby (Instrumental),A,150.00,6
Armor For Sleep,Five Song Demo,All Warm,Bm,147.12,7
Armor For Sleep,Instrumental,My Saving Grace (Instrumental),E,145.00,7
Armor For Sleep,Caught In A Daze - Single,Caught In A Daze (Studio Version),D,111.85,7
Armor For Sleep,Dream to Make Believe,Being Your Walls,G#m,128.00,5
Armor For Sleep,What To Do When You Are Dead,Remember To Feel Real,Em,82.39,6
Armor For Sleep,What to Do When You Are Dead (15th Anniversary),Stay on the Ground,Am,80.04,7
Armor For Sleep,What To Do When You Are Dead,"Walking At Night, Alone",D,157.22,6
Armor For Sleep,Smile For Them (Standard Version),Hold the Door,E,82.00,6
Armor For Sleep,What To Do When You Are Dead,The End Of A Fraud,Dm,80.01,5
Armor For Sleep,What to Do When You Are Dead (15th Anniversary),The Truth About Heaven (Demo),Bm,91.92,6
Armor For Sleep,Five Song Demo,Pointless Forever,D,84.38,7
Armor For Sleep,Masters Of Horror,Very Invisible,F#m,80.02,5
