Artist,Album,Title,Key,BPM,Energy
Instrumental Beats,Instrumental Beats,ALONElofi (sad chill rap ),C,95.00,3
Instrumental Beats,Instrumental Beats,Post Malone x Iann Dior Emotion,D#,152.00,5
Instrumental Beats,Instrumental Beats,Ripsquad x Senses royal (Prod odece),Fm,120.00,6
Instrumental Beats,Instrumental Beats,pls,Em,87.50,7
Instrumental Beats,Instrumental Beats,Halo Lil Durk (prod by WhoKares),C#m,152.58,4
Instrumental Beats,Instrumental Beats,Falling Iann Dior x Juice WRLD ,Bm,140.00,4
Instrumental Beats,Instrumental Beats,Words Yung Lean x Bones (Prod Bleach),Bm,125.01,4
Instrumental Beats,Instrumental Beats,Bones X Xavier Wulf Ive Been There Prod Kejzi,C#m,127.00,4
Instrumental Beats,Instrumental Beats,Frozen Heart,F,87.50,6
Instrumental Beats,Instrumental Beats,OAF1 & DOLLY NOSGOV SURF,C,79.94,5
Instrumental Beats,Instrumental Beats,"leaning alt lil peep x nothing,nowhere (prod loopy!) ",C#,135.00,3
Instrumental Beats,Instrumental Beats,SuicideboyS x Lil Xan sad ambient Empty Sreets,Gm,109.97,5
Instrumental Beats,Instrumental Beats,Post Malone Lovemark,Dm,140.00,4
Instrumental Beats,Instrumental Beats,BLADEE x BONES x GRIMES sangang,Am,115.02,4
Instrumental Beats,Instrumental Beats,hyperpop lil uzi vert poggers,Am,79.59,5
Instrumental Beats,Instrumental Beats,PUNK OAF1 x DREAMCACHE x PARTYCJA ,F#m,83.50,8
Instrumental Beats,Instrumental Beats,Robbery,Bm,79.50,3
Instrumental Beats,Instrumental Beats,Lil Uzi Vert Diamonds (ProdBy Dee B),F#m,82.55,5
Instrumental Beats,Instrumental Beats,nosgov x bladee building blocks,C,142.00,5
Instrumental Beats,Instrumental Beats,Ambient Trap,F#m,146.99,5
Instrumental Beats,Instrumental Beats,AURA x ERIC NORTH x SANFAK sangang,Gm,155.99,5
Instrumental Beats,Instrumental Beats,bladee x lil uzi vert okinawa,Bm,140.38,5
Instrumental Beats,Instrumental Beats,Loneliness (Prod Cutdembandz),C#m,157.00,5
Instrumental Beats,Instrumental Beats,lil peep xxxtentacion coming home sad guitar ,Gm,121.01,5
Instrumental Beats,Instrumental Beats,Kotoamatsukami,B,110.00,4
Instrumental Beats,Instrumental Beats,My Flaws Burn Through My Skin Like Demonic Flames From Hell,Bm,126.00,4
Instrumental Beats,Instrumental Beats,glitchcore x capoxxo x sebii message,D#m,139.89,5
Instrumental Beats,Instrumental Beats,DARK CLOUD RAP NIGHT LOVELL X BONES X PHARAOH,Cm,125.01,3
Instrumental Beats,Instrumental Beats,Whitearmor & bladee & vinso basket,F#m,156.01,6
Instrumental Beats,Instrumental Beats,NF x XXXTentacion Amber,G,114.00,4
Instrumental Beats,Instrumental Beats,under my skin (prod arieseternal),A,139.55,5
Instrumental Beats,Instrumental Beats,How To Hyperpop x Lil Uzi Vert ,Fm,140.03,5
Instrumental Beats,Instrumental Beats,Bones Waterfall,Em,110.00,4
Instrumental Beats,Instrumental Beats,Qq,F#m,145.74,7
Instrumental Beats,Instrumental Beats,HARD LIL WOP x KAMIYADA x BLVC SVND sangang,Cm,124.00,6
Instrumental Beats,Instrumental Beats,Hyperpop x Glitchcore x LXNER synth (Prod Soft Clipper),G#m,134.70,4
Instrumental Beats,Instrumental Beats,DEKO x YAMEII x BLADEE sangang,Bm,85.00,6
Instrumental Beats,Instrumental Beats,bladee x shinigami zelda,E,155.02,5
Instrumental Beats,Instrumental Beats,BAD LIAR,D#m,81.63,5
Instrumental Beats,Instrumental Beats,Night lovell vocal sampeled (Trap Instrumental),Cm,120.00,6
Instrumental Beats,Instrumental Beats,Pop Retro NEW ,C,138.65,4
Instrumental Beats,Instrumental Beats,Huyna s,Cm,155.06,8
Instrumental Beats,Instrumental Beats,Aihara,C,87.00,8
Instrumental Beats,Instrumental Beats,PLAYBOI CARTI x LIL UZI VERT x 2 SEAT sangang,Cm,83.04,6
Instrumental Beats,Instrumental Beats,convolk x globan dan (prod lil kami),Cm,120.03,4
Instrumental Beats,Instrumental Beats,Sad Xxxtentacion Horizon (Ft Mishaal) ,F#m,105.00,4
Instrumental Beats,Instrumental Beats,HARD LIL DARKIE x WENDIGO x NASCAR ALOE x FORLORN sangang,Cm,139.62,6
Instrumental Beats,Instrumental Beats,Yeat x Kankan Run,Bm,139.97,4
Instrumental Beats,Instrumental Beats,UicideboyS seraph (320 Kbps),C#m,135.00,5
Instrumental Beats,Instrumental Beats,Dfaite,Cm,140.00,8
Instrumental Beats,Instrumental Beats,oaf1 Capoxxo dreamcache lights,A#m,150.00,5
Instrumental Beats,Instrumental Beats,Retrospective,F#m,139.88,5
Instrumental Beats,Instrumental Beats,Lil Tjay To Many Chances ProdRellyMade ,C#m,120.00,5
Instrumental Beats,Instrumental Beats,SEO,A#m,80.00,7
Instrumental Beats,Instrumental Beats,NINTENDO ZELDA x MEAT COMPUTER x AXXTUREL ,Bm,79.97,6
Instrumental Beats,Instrumental Beats,hyperpop x sebii x lil uzi vert ,A#m,143.00,4
Instrumental Beats,Instrumental Beats,Iann Dior Juice Wrld Anime Rain,A,155.00,6
Instrumental Beats,Instrumental Beats,SAD XXXTENTACION Ill be good,Dm,80.01,3
Instrumental Beats,Instrumental Beats,valentine,B,146.02,8
Instrumental Beats,Instrumental Beats,OAF1 & ICEDANCER & CAPOXXO & NOSGOV square,D,140.03,5
Instrumental Beats,Instrumental Beats,NF x Ivan B Pray For Us,Fm,134.90,4
Instrumental Beats,Instrumental Beats,Juice WRLD Messages Melodic Trap s,Fm,141.43,4
Instrumental Beats,Instrumental Beats,Lil Peep x Juice WRLD Guitar Falling Down (Prod By Pastnight),B,150.00,6
Instrumental Beats,Instrumental Beats,Bladee Dolly Ddertbag contacts,G,140.08,4
Instrumental Beats,Instrumental Beats,Boys Tears,Bm,82.50,5
Instrumental Beats,Instrumental Beats,Nick Mira & Iann Dior sailor moon,A#,82.92,4
Instrumental Beats,Instrumental Beats,Riot,Bm,90.01,8
Instrumental Beats,Instrumental Beats,New Beginnings,C#m,130.00,4
Instrumental Beats,Instrumental Beats,Kevin Gates Let U Down Smooth Rap Instrumental,Fm,139.08,4
Instrumental Beats,Instrumental Beats,SYBYR x ERIC NORTH x CXRPSE sangang,Fm,146.09,6
Instrumental Beats,Instrumental Beats,CD,D#m,142.01,4
Instrumental Beats,Instrumental Beats,Lil Peep Alternative Rock Broken Heart Trap Guitar Instrumental ,Am,135.00,5
Instrumental Beats,Instrumental Beats,sad guitar falling slow,C#m,110.65,3
Instrumental Beats,Instrumental Beats,luv moon,F#m,144.00,5
Instrumental Beats,Instrumental Beats,Juice WRLD x iann dior Error,F#m,154.00,5
Instrumental Beats,Instrumental Beats,Lil Skies x Lil Uzi Vert Mood ,Dm,155.99,5
Instrumental Beats,Instrumental Beats,capoxxo x dreamcache x oaf1 dojo,A#m,86.51,6
Instrumental Beats,Instrumental Beats,Marty Mcfly,C,130.00,3
Instrumental Beats,Instrumental Beats,Trippie Redd Iann Dior Lil Skies Juice Wrld solar,Cm,130.00,4
Instrumental Beats,Instrumental Beats,For Profit Hard style X Flute Trap Mystic,C#m,140.00,4
Instrumental Beats,Instrumental Beats,We Dont Talk Lil Peep prod gucci tears,Cm,127.86,4
Instrumental Beats,Instrumental Beats,How To Make a Hyperpop x Lil Uzi Vert x Marshmello ,Em,149.40,4
Instrumental Beats,Instrumental Beats,mirage,D#,145.02,7
Instrumental Beats,Instrumental Beats,Bladee & ripsquad & Whitearmor One Way,Fm,139.98,5
Instrumental Beats,Instrumental Beats,Smrt Death x Lil Peep Freak (ProdYasuu),Em,97.00,5
Instrumental Beats,Instrumental Beats,XXXTENTACION Lofi In my head (ft @iriasona) Sad Sample Instrumental,Fm,148.03,3
Instrumental Beats,Instrumental Beats,SYBYR x LANDFILL x ANTIWORLD x BLVC SVND ,Fm,99.76,5
Instrumental Beats,Instrumental Beats,ICYTWAT X PLAYBOI CARTI X BLADEE sangang,Am,130.00,6
Instrumental Beats,Instrumental Beats,6lack Piano Ambient Instrumental No Connection,G#m,116.04,5
Instrumental Beats,Instrumental Beats,bladee x lil uzi vert x shinigami shield,A#m,84.97,6
Instrumental Beats,Instrumental Beats,ericdoa x sebii x shinigami spring,Gm,158.00,5
Instrumental Beats,Instrumental Beats,Back To Back J Cole ft Logic ,Am,130.01,4
Instrumental Beats,Instrumental Beats,alone,C#,80.63,4
Instrumental Beats,Instrumental Beats,lil uzi vert x bladee detail,Dm,81.00,5
Instrumental Beats,Instrumental Beats,SADCHILL BONES JustAsIThought (prod norfwrath),Cm,130.00,5
Instrumental Beats,Instrumental Beats,Iann Dior Poorstacy Juice WRLD love me,C#m,155.00,5
Instrumental Beats,Instrumental Beats,Juice WRLD x iann dior Moon ,C#m,150.00,5
Instrumental Beats,Instrumental Beats,Bladee x drain gang x EFFIE x ripsquad (prod cozin),B,139.00,6
Instrumental Beats,Instrumental Beats,"guccihighwaters, notmorgn stressed (prod irby)",F#m,130.01,5
Instrumental Beats,Instrumental Beats,lil uzi vert x ken carson may,Fm,158.00,4
Instrumental Beats,Instrumental Beats,ripsquad x hyperpop x kawai ,D#,80.02,6
Instrumental Beats,Instrumental Beats,panic attack,F,140.03,6
Instrumental Beats,Instrumental Beats,Remember Me Lil Peep x WifisFuneral (Prod Christian Gonzalez),Bm,86.40,5
Instrumental Beats,Instrumental Beats,ELECTRONIC OAF1 x DREAMCACHE x CARAMELLA GIRLS sangang,Em,82.50,6
Instrumental Beats,Instrumental Beats,6lack & Blackbear NOVACANE Lofi R&B,Cm,100.12,5
Instrumental Beats,Instrumental Beats,xxxtentacion x billie eilish ft post malone i wanna know Prod Tundras,F#m,122.95,4
Instrumental Beats,Instrumental Beats,KANKAN x YEAT x CLUTHCHILL ,C#m,148.00,4
Instrumental Beats,Instrumental Beats,Zayn x Khalid Touch (Prod Pacific) Chill Pop Instrumental ,C#m,82.00,6
Instrumental Beats,Instrumental Beats,Sick (NF Witt Lowry) Prod by Trunxks ,F#m,140.00,4
Instrumental Beats,Instrumental Beats,Dolly & Oaf1 & d1v driving,C,84.99,6
Instrumental Beats,Instrumental Beats,You,D#m,153.01,5
Instrumental Beats,Instrumental Beats,jane remover x quannnic x underscores x dariacore (prodcrystalcry),A#m,80.95,7
Instrumental Beats,Instrumental Beats,Dolly & Kiryano & blackwinterwells airplane,A,154.01,4
Instrumental Beats,Instrumental Beats,Juice Wrld x Bryson Tiller My Way,Cm,100.00,4
Instrumental Beats,Instrumental Beats,vinso & nosgov & bladee horizon,Fm,153.99,6
Instrumental Beats,Instrumental Beats,bladee x lil uzi vert kumori,Gm,81.50,4
Instrumental Beats,Instrumental Beats,CRYSTAL CASTLES x REX ORANGE COUNTY x CYBERPUNK ,Dm,136.06,8
Instrumental Beats,Instrumental Beats,Vinso x Shinjin x Bladee x Whitearmor weee (ProdYobiee),D,149.99,4
Instrumental Beats,Instrumental Beats,YEAT x DESTROY LONELY x KANKAN ,Cm,144.00,7
Instrumental Beats,Instrumental Beats,Aguri,E,150.11,5
Instrumental Beats,Instrumental Beats,Say So Melodic Instrumental,Em,79.50,5
Instrumental Beats,Instrumental Beats,Distance Why Dont We x Lauv Inspired Instrumental (Prod Pacific),E,105.00,5
Instrumental Beats,Instrumental Beats,PLAYBOI CARTI x PIERRE BOURNE x 6 DOGS sangang,Bm,157.01,5
Instrumental Beats,Instrumental Beats,hyperpop x glaive x lil uzi vert fallen,D#m,150.00,5
Instrumental Beats,Instrumental Beats,shinigami x hyperpop x sebii ,Fm,87.84,4
Instrumental Beats,Instrumental Beats,yung lean x bladee x draingang weirdoutside (Prod methboiswag),D#m,153.08,6
Instrumental Beats,Instrumental Beats,Emotional Progressive Djent Backing Track Instrumental Always,C#m,140.00,7
Instrumental Beats,Instrumental Beats,nature,B,92.50,5
Instrumental Beats,Instrumental Beats,LIL PEEP x GUCCIHIGHWATERS x 6OBBY DO IT OVER AGAIN Prod J2ONTHE,G#,129.98,4
Instrumental Beats,Instrumental Beats,OCEANS BONES EMOTIONAL INSPIRING INSTRUMENTAL,F#m,120.00,3
Instrumental Beats,Instrumental Beats,Juice Wrld Feelings Prod By kimj,A,82.50,6
Instrumental Beats,Instrumental Beats,ALTERNATIVE ROCK x ROJUU x NARAKA sangang,Cm,108.00,6
Instrumental Beats,Instrumental Beats,Suicidal Juice Wrld x Lil Peep x Kcaaz (Prod Kcaaz),A#m,150.00,6
Instrumental Beats,Instrumental Beats,BradleyCooperLadyGagaShallowInstrumentalProdByBenjaminRiceLadyGaga,G,95.47,4
Instrumental Beats,Instrumental Beats,"Withered nothing,nowhere x NF Sad Emotional Guitar x Piano Instrumental",Dm,89.61,4
Instrumental Beats,Instrumental Beats,nick mira x dro kenji heat,C#m,140.05,5
Instrumental Beats,Instrumental Beats,Lil Peep x Smrtdeath guardian (Prod Odece),E,136.85,6
Instrumental Beats,Instrumental Beats,osquinn x hyperpop x ericdoa ice cream,F#,140.16,5
Instrumental Beats,Instrumental Beats,Skeletons Lil Tracy x Lil Peep (Prod Bleach),F,145.15,3
Instrumental Beats,Instrumental Beats,Beta,D,137.05,7
Instrumental Beats,Instrumental Beats,Ferrari,Am,81.00,5
Instrumental Beats,Instrumental Beats,YUNG SHERMAN x BLADEE x YUNG LEAN ,C#m,122.00,7
Instrumental Beats,Instrumental Beats,Cry Baby,F#m,155.00,5
Instrumental Beats,Instrumental Beats,Xxxtentacion sad sample (Feat Shiloh Dynasty),C,119.98,5
Instrumental Beats,Instrumental Beats,Deep Storytelling Trap Instrumental Kevin Gates Inferior (Prod Blue Mist s),Em,98.67,3
Instrumental Beats,Instrumental Beats,Future x Lil Skies Lust,Bm,138.01,4
Instrumental Beats,Instrumental Beats,Juice WRLD Same Girls (Prod Pacific) Chill NAV & Lil SkiesGm,G#m,83.00,4
Instrumental Beats,Instrumental Beats,DARK LIFE XXXTENTACION x SUICIDE BOYS x GHOSTEMANE ,Bm,140.01,4
Instrumental Beats,Instrumental Beats,Juice WRLD Nobody But You Ft Lil Peep Instrumental,Bm,156.00,6
Instrumental Beats,Instrumental Beats,NF FADED Epic Dramatic Piano Instrumental (Prod Stars) ,F#m,140.06,4
Instrumental Beats,Instrumental Beats,Bones Paper Chasing,G,124.01,5
Instrumental Beats,Instrumental Beats,HARD BLVC SVND x MCH x CXRPSE sangang,Em,122.00,6
Instrumental Beats,Instrumental Beats,YBN Cordae Kung Fu (WSHH Exclusive Official Music Video),Gm,124.94,6
Instrumental Beats,Instrumental Beats,l youre as iful as a rose LiL PEEP l ProdXET Dm,D#m,153.33,6
Instrumental Beats,Instrumental Beats,ALTERNATIVE ROCK X EMO TRAP STAY YOURSELF (prod xenshel),F,153.00,5
Instrumental Beats,Instrumental Beats,EQ,A,140.16,6
Instrumental Beats,Instrumental Beats,Post Malone Zone Trap Instrumental,Fm,120.00,4
Instrumental Beats,Instrumental Beats,Rays Hope,Am,130.00,5
Instrumental Beats,Instrumental Beats,Bladee lil Uzi Vert Nosgov security,Fm,140.01,4
Instrumental Beats,Instrumental Beats,Hard Roddy Ricch (prod by WhoKares),Gm,134.56,3
Instrumental Beats,Instrumental Beats,LIGHTSPEED,G#m,133.36,5
Instrumental Beats,Instrumental Beats,AURA x ERIC NORTH x LIL UZI VERT sangang,A#m,82.97,5
Instrumental Beats,Instrumental Beats,Lil Lotus x Alternative Rock White Lies (Prod Yago),Bm,120.00,7
Instrumental Beats,Instrumental Beats,suffering,Fm,80.00,8
Instrumental Beats,Instrumental Beats,NF x 6lack Fall Apart Sad Piano Instrumental ,Gm,140.00,2
Instrumental Beats,Instrumental Beats,d0llywood1 x lieu x blackwinterwells weightlessness + rvrhiv,A#m,84.50,6
Instrumental Beats,Instrumental Beats,Broken Vows,D,140.00,6
Instrumental Beats,Instrumental Beats,COLD Trap Instrumental Trap ( Prod By Gherah ),G#m,120.02,6
Instrumental Beats,Instrumental Beats,yeat x lil uzi vert sweet,D#m,81.16,5
Instrumental Beats,Instrumental Beats,XXXTENTACION x Kina Soul ,D#,144.02,5
Instrumental Beats,Instrumental Beats,ripsquad x maknae x waifu arise,A,138.13,4
Instrumental Beats,Instrumental Beats,Post Malone ALONE,Gm,121.49,3
Instrumental Beats,Instrumental Beats,SUICIDEBOYS MORTAR BARRAGE,Fm,122.00,4
Instrumental Beats,Instrumental Beats,ripsquad x bladee x kiryano alley,Fm,140.00,5
Instrumental Beats,Instrumental Beats,Squad,Em,90.00,5
Instrumental Beats,Instrumental Beats,93feetofsmoke x Shinigami My Memory Prod Yago,Dm,115.00,5
Instrumental Beats,Instrumental Beats,FAST LANE ,Dm,150.02,4
Instrumental Beats,Instrumental Beats,Sad Lil Lotus x Lil Tracy (Prod Spyder),F#,143.00,4
Instrumental Beats,Instrumental Beats,Arizona Zervas Malibu (Prod Pacific),G#m,85.75,3
Instrumental Beats,Instrumental Beats,MGK x Jxdn x Blackbear Pop Punk Chalk (feat King Theta),Gm,146.00,7
Instrumental Beats,Instrumental Beats,Farewell My Friend Lil Peep x lil aaron prod gucci tears,E,120.00,5
Instrumental Beats,Instrumental Beats,ROYALTY ) Happy Up Lil Uzi Vert RapHip Hop Instrumental Gas,Gm,129.11,5
Instrumental Beats,Instrumental Beats,Xxxtentacion x NF Roses Sad Piano Instrumental ,Em,120.00,4
Instrumental Beats,Instrumental Beats,Juice Wrld Nostalgia Prod By kimj and Relik ,G#m,82.50,5
Instrumental Beats,Instrumental Beats,Saeep Emotional Trap Depressive Rap Instrumental (Mirov s),Gm,122.00,6
Instrumental Beats,Instrumental Beats,Bryson Tiller They Say (Prod NextLane s) ,F#,90.00,4
Instrumental Beats,Instrumental Beats,convolk x worried sick x iann dior worried sick ,C#m,92.00,5
Instrumental Beats,Instrumental Beats,lil peep (sad guitar ) SELFISH,D#m,140.00,4
Instrumental Beats,Instrumental Beats,Broken Heart  Sad R&B Piano Instrumental ,A#,98.19,3
Instrumental Beats,Instrumental Beats,SUCIDE BOYS MUSIC BOX,D#m,140.00,4
Instrumental Beats,Instrumental Beats,XXXTENTACION Devil Just Trying to Be Seen,Am,90.00,3
Instrumental Beats,Instrumental Beats,IC3PEAK x SLEEPISFORMORTALS x TECHNO sangang,F#m,125.00,7
Instrumental Beats,Instrumental Beats,Lil skies x JuiceWRLD (Prod CapsCtrl),Cm,120.00,5
Instrumental Beats,Instrumental Beats,whitearmor x bladee x ambient ikigai,Cm,139.62,4
Instrumental Beats,Instrumental Beats,Lil Peep HorseHead (Stay),G,150.89,5
Instrumental Beats,Instrumental Beats,Sadness,F#m,79.99,5
Instrumental Beats,Instrumental Beats,Prosti,Em,150.34,4
Instrumental Beats,Instrumental Beats,bladee x trippie redd caramel,Dm,155.96,5
Instrumental Beats,Instrumental Beats,Kirby,A,155.99,5
Instrumental Beats,Instrumental Beats,Tsukasa,Gm,80.05,5
Instrumental Beats,Instrumental Beats,Spring,Bm,146.98,6
Instrumental Beats,Instrumental Beats,Trap Rap Hip Hop Instrumental Decibel Lirical,E,120.00,4
Instrumental Beats,Instrumental Beats,LiL Peep burning my heart (prod kuroime & 5head) Alternative rock,G#m,140.00,5
Instrumental Beats,Instrumental Beats,poorstacy x Iaan dior x JuiceWRLD idc Prod Suicide Weeb,Bm,80.01,5
Instrumental Beats,Instrumental Beats,Juice WRLD x Iann Dior Your New Boyfriends Dumb (Prod Guala z x DREAMR),B,92.50,5
Instrumental Beats,Instrumental Beats,glaive x hyperpop summer mood,C#,90.01,5
Instrumental Beats,Instrumental Beats,Lil peep Xxxtentacion (Prod CapsCtrl),Em,110.00,6
Instrumental Beats,Instrumental Beats,NF x Ivan B FOREVER Emotional Piano SAD (Prod Stars) ,C,130.00,3
Instrumental Beats,Instrumental Beats,Subaeris x Blank Banshee x Yung Bae VAPORTRAP travel,C,127.95,3
Instrumental Beats,Instrumental Beats,hate myself,Gm,137.45,5
Instrumental Beats,Instrumental Beats,Kiryano & bladee & oaf1 earphones,Dm,150.01,6
Instrumental Beats,Instrumental Beats,"Greaf Lil Peep Bones NothingNowhere , Give Credit Prod Angelvs",Em,111.00,4
Instrumental Beats,Instrumental Beats,Juice Wrld Lil Skies (Wrist Dmg),G#m,140.00,3
Instrumental Beats,Instrumental Beats,ivvy league x ripsquad x elxnce x vinso strike 3,C#m,85.27,6
Instrumental Beats,Instrumental Beats,XXXTENTACION Tired I Sad Instrumental ,C#,80.00,3
Instrumental Beats,Instrumental Beats,XXXTENTACION 6lack NF castaway ,Fm,95.00,4
Instrumental Beats,Instrumental Beats,luvbackpack ripsquad kiryano natto,Dm,153.06,5
Instrumental Beats,Instrumental Beats,Lost XXXTentacion x Juice WRLD Guitar Emotional MIROV S,F#m,116.01,6
Instrumental Beats,Instrumental Beats,BONES x CLAMS CASINO x AMBIENT CALM,Em,130.01,5
Instrumental Beats,Instrumental Beats,XAVIER WULF X BONES POLAR PROD SANTOS SANTANA,Cm,129.97,5
Instrumental Beats,Instrumental Beats,whitearmor & nosgov & ddertbag melon,C,142.07,5
Instrumental Beats,Instrumental Beats,Best Friend,Gm,154.06,4
Instrumental Beats,Instrumental Beats,Dolly & Kiryano & shinjin circle,Dm,80.17,5
Instrumental Beats,Instrumental Beats,senses x nosgov x vinso sunny,Em,84.90,6
Instrumental Beats,Instrumental Beats,Oliver Francis Stay Down (Infinity Boy),C,127.00,4
Instrumental Beats,Instrumental Beats,Calling Lil Durk (prod by WhoKares),Am,80.23,3
Instrumental Core,,"Hard Metal Core Instrumental | Regen - ""Falsch"" JMA Instrumental",Fm,90.00,7
internet joe,Hyperpop Instrumentals,Bladee x Lil Uzi Vert Hyperpop Funfair (prod Proz),Am,123.00,5
internet joe,Hyperpop Instrumentals,Bladee x Drain Gang x Ripsquadd Hyperpop Neon City (prod Proz),Fm,135.00,6
internet joe,Hyperpop Instrumentals,100 Gecs x capoxxo x Nightcore Hyperpop Libra World (prod Proz),A#m,82.50,5
internet joe,Hyperpop Instrumentals,bladee x novagang x ripsquad x dolly three (prod internet joe),A,136.00,6
internet joe,Hyperpop Instrumentals,Bladee x Deko Hyperpop Midnight Sun (prod Proz),Am,142.00,6
internet joe,Hyperpop Instrumentals,Hyperpop x Eurodance x Nightcore Break Your Heart (prod Proz),Am,84.00,7
internet joe,Hyperpop Instrumentals,vinso + shinjin + ripsquad (internet joe + Souls 1),Cm,85.00,6
internet joe,Hyperpop Instrumentals,Bladee x 100 Gecs Hyperpop Baby Pink (prod Proz),C,140.00,6
internet joe,Hyperpop Instrumentals,novagang x bladee x david shawty x ripsquad (prod internet joe x tommiiexo),D#m,141.99,6
internet joe,Hyperpop Instrumentals,bladee x ripsquad x vinso x shinjin (internet joe tommet),G#,151.02,6
internet joe,Hyperpop Instrumentals,ripsquad bladee shinjin (internet joe),G,146.00,7
internet joe,Hyperpop Instrumentals,Bladee x Lil Uzi Vert Hyperpop Nemesis(prod Proz),F#m,155.00,5
internet joe,Hyperpop Instrumentals,Hyperpop x Eurodance x Nightcore Tundra (prod Proz),D#,143.99,6
internet joe,Hyperpop Instrumentals,capoxxo x oaf1 x Nightcore Hyperpop Dance Again (prod Proz),C,145.00,6
internet joe,Hyperpop Instrumentals,bladee ripsquad shinjin (internet joe),G,151.01,6
internet joe,Hyperpop Instrumentals,bladee ripsquad vinso shinjin (internet joe),F#,143.01,6
internet joe,Hyperpop Instrumentals,Bladee x capoxxo Hyperpop Whatever (prod Proz),Em,132.93,5
internet joe,Hyperpop Instrumentals,bladee x ripsquad x maknae (prod internet joe x northeast lights),A,157.00,6
internet joe,Hyperpop Instrumentals,vinso + shinjin + ripsquad (internet joe + irusu),D,140.01,6
internet joe,Hyperpop Instrumentals,kets4eki x Starkids x Hyperpop Water & Fire (prod Proz),D#m,87.50,7
internet joe,Hyperpop Instrumentals,bladee x ripsquad x shinigami x novagang (prod internet joe),D#m,157.02,5
internet joe,Hyperpop Instrumentals,Lil Uzi Vert x Bladee HYPERPOP Toon World (prod Proz),Gm,144.00,5
internet joe,Hyperpop Instrumentals,100 Gecs x capoxxo x Nightcore Hyperpop Brain Swap (prod Proz),F,157.00,6
internet joe,Hyperpop Instrumentals,bladee ripsquad shinjin (internet joe Souls 1),D,130.00,5
internet joe,Hyperpop Instrumentals,Bladee x Shinigami x Ripsquad x (prod Internet Joe x Northeast Lights),Fm,144.98,6
internet joe,Hyperpop Instrumentals,kets4eki x Capoxxo x Hyperpop Tr0uble (prod Proz),C#m,145.00,6
internet joe,Hyperpop Instrumentals,bladee x ripsquad x novagang x dolly icedancer (prod internet joe),C,80.90,5
internet joe,Hyperpop Instrumentals,Bladee x Shinigami x Ecco2k x Ripsquad (prod internet joe x nate2timez),D,150.01,5
internet joe,Hyperpop Instrumentals,Lil Uzi Vert Hyperpop 7th Seal (prod Proz),Am,79.99,5
internet joe,Hyperpop Instrumentals,Scenecore x EDM x Hyperpop Chosen (prod Proz),Em,144.00,6
internet joe,Hyperpop Instrumentals,Bladee x Hyperdrill x Hyperpop Starship (prod Proz),Em,150.00,5
internet joe,Hyperpop Instrumentals,capoxxo x oaf1 x Nightcore Hyperpop New Moon (prod Proz),C,85.00,7
internet joe,Hyperpop Instrumentals,Scenecore x Club x Hyperpop Miracles (prod Proz),C#m,105.00,6
internet joe,Hyperpop Instrumentals,capoxxo x Yeat x pluggndance Hyperpop Unravel (prod Proz),Gm,156.99,4
internet joe,Hyperpop Instrumentals,Scenecore x Nightcore x Hyperpop Myspace (prod Proz),D#m,82.50,8
internet joe,Hyperpop Instrumentals,lieu @notlieu x david shawty x novagang x kurtains (prod internet joe x nate2timez),F,93.50,4
internet joe,Hyperpop Instrumentals,ripsquad x novagang x bladee x 5v (prod internet joe),A#,150.00,6
internet joe,Hyperpop Instrumentals,bladee x novagang x david shawty x shinigami (prod internet joe),A,156.01,5
internet joe,Hyperpop Instrumentals,Scenecore x Rave x Hyperpop Miss Me (prod Pr z + Andylovu),E,145.00,6
internet joe,Hyperpop Instrumentals,100 Gecs x Eurodance Hyperpop On Pluto (prod Proz),Am,145.00,6
internet joe,Hyperpop Instrumentals,ripsquad x bladee x david shawty x shinigami (prod internet joe),D,140.00,6
internet joe,Hyperpop Instrumentals,Deko x Bladee Hyperpop Dreamland Saga (prod Pr z + Silva z),C#,80.08,4
internet joe,Hyperpop Instrumentals,100 Gecs x capoxxo x Nightcore Hyperpop Knights Of The Zodiac(prod Proz),D,82.50,6
internet joe,Hyperpop Instrumentals,ripsquad x novagang x bladee x shinigami (prod internet joe),D#,147.00,6
internet joe,Hyperpop Instrumentals,Dark Scenecore x Rave x Hyperpop Mercy (prod Proz),Bm,87.49,8
internet joe,Hyperpop Instrumentals,Scenecore x Rave x Hyperpop Wings (prod Pr z + Andylovu),C#m,150.00,7
internet joe,Hyperpop Instrumentals,capoxxo x oaf1 x Nightcore Hyperpop Bewitched (prod Proz),B,155.00,7
internet joe,Hyperpop Instrumentals,bladee ripsquad sg lily shinjin (internet joe northeast lights),B,80.50,6
internet joe,Hyperpop Instrumentals,Bladee x Capoxxo Hyperpop Astral Zone (prod Proz),Bm,87.50,5
internet joe,Hyperpop Instrumentals,Bladee x Ripsquad x Shinigami (prod internet joe x nate2timez),Dm,145.00,5
internet joe,Hyperpop Instrumentals,bladee x ripsquad x vinso (prod @internetjoee iceboi),G,152.92,6
internet joe,Hyperpop Instrumentals,100 Gecs x Lil Uzi Vert Hyperpop Elixir (prod Proz),Gm,84.00,5
internet joe,Hyperpop Instrumentals,ripsquad + bladee + shinjin (internet joe),E,156.00,6
internet joe,Hyperpop Instrumentals,Playboi Carti x MexikoDro PLUG Destiny (prod Proz),C,149.99,4
internet joe,Hyperpop Instrumentals,Bladee x Capoxxo Hyperpop Levels (prod Proz),A#m,80.01,8
internet joe,Hyperpop Instrumentals,Bladee x Lil Uzi Vert Hyperpop Curse(prod Pr z + tezza),G#m,82.57,5
internet joe,Hyperpop Instrumentals,Scenecore x Rave x Hyperpop Next Gen (prod Proz),A#,85.00,6
internet joe,Hyperpop Instrumentals,Bladee x Lil Uzi Vert Hyperpop Alola (prod Proz),Fm,150.00,4
internet joe,Hyperpop Instrumentals,Playboi Carti x Lil Uzi Vert HYPERPOP Topaz (prod Proz),G#m,80.01,5
internet joe,Hyperpop Instrumentals,Lil Uzi Vert x Popp Hunna HYPERPOP Saffron (prod Proz),Fm,150.99,6
Isles & Glaciers,The Hearts of Lonely People,Viola Lion,Bm,149.00,7
Isles & Glaciers,The Hearts of Lonely People (Remixes),Hills Like White Elephants (Brian Southall Remix),F#m,95.00,6
Isles & Glaciers,The Hearts of Lonely People,Hills Like White Elephants,F#m,95.00,7
Isles & Glaciers,The Hearts of Lonely People (Remixes),Cemetery Weather (Piano Version),C,123.90,3
Isles & Glaciers,The Hearts of Lonely People,Kings and Chandeliers,F#m,126.71,4
